00:03:03.711675 IP 192.168.56.101.33976 > 192.168.56.1.5001: UDP, length 1470
00:03:03.723883 IP 192.168.56.101.33976 > 192.168.56.1.5001: UDP, length 1470
00:03:03.736018 IP 192.168.56.101.33976 > 192.168.56.1.5001: UDP, length 1470
00:03:03.748386 IP 192.168.56.101.33976 > 192.168.56.1.5001: UDP, length 1470
00:03:03.772281 IP 192.168.56.101.33976 > 192.168.56.1.5001: UDP, length 1470
00:03:03.784340 IP 192.168.56.101.33976 > 192.168.56.1.5001: UDP, length 1470
00:03:03.796496 IP 192.168.56.101.33976 > 192.168.56.1.5001: UDP, length 1470
00:03:03.808530 IP 192.168.56.101.33976 > 192.168.56.1.5001: UDP, length 1470
00:03:03.833212 IP 192.168.56.101.33976 > 192.168.56.1.5001: UDP, length 1470
00:03:03.844805 IP 192.168.56.101.33976 > 192.168.56.1.5001: UDP, length 1470
00:03:03.856933 IP 192.168.56.101.33976 > 192.168.56.1.5001: UDP, length 1470
00:03:03.869465 IP 192.168.56.101.33976 > 192.168.56.1.5001: UDP, length 1470
00:03:03.894379 IP 192.168.56.101.33976 > 192.168.56.1.5001: UDP, length 1470
00:03:03.905668 IP 192.168.56.101.33976 > 192.168.56.1.5001: UDP, length 1470
00:03:03.917517 IP 192.168.56.101.33976 > 192.168.56.1.5001: UDP, length 1470
00:03:03.929646 IP 192.168.56.101.33976 > 192.168.56.1.5001: UDP, length 1470
00:03:03.953902 IP 192.168.56.101.33976 > 192.168.56.1.5001: UDP, length 1470
00:03:03.966390 IP 192.168.56.101.33976 > 192.168.56.1.5001: UDP, length 1470
00:03:03.977871 IP 192.168.56.101.33976 > 192.168.56.1.5001: UDP, length 1470
00:03:03.990002 IP 192.168.56.101.33976 > 192.168.56.1.5001: UDP, length 1470
00:03:04.016030 IP 192.168.56.101.33976 > 192.168.56.1.5001: UDP, length 1470
00:03:04.027286 IP 192.168.56.101.33976 > 192.168.56.1.5001: UDP, length 1470
00:03:04.038729 IP 192.168.56.101.33976 > 192.168.56.1.5001: UDP, length 1470
00:03:04.050485 IP 192.168.56.101.33976 > 192.168.56.1.5001: UDP, length 1470
00:03:04.074897 IP 192.168.56.101.33976 > 192.168.56.1.5001: UDP, length 1470
00:03:04.086762 IP 192.168.56.101.33976 > 192.168.56.1.5001: UDP, length 1470
00:03:04.099325 IP 192.168.56.101.33976 > 192.168.56.1.5001: UDP, length 1470
00:03:04.111040 IP 192.168.56.101.33976 > 192.168.56.1.5001: UDP, length 1470
00:03:04.135195 IP 192.168.56.101.33976 > 192.168.56.1.5001: UDP, length 1470
00:03:04.147435 IP 192.168.56.101.33976 > 192.168.56.1.5001: UDP, length 1470
00:03:04.159601 IP 192.168.56.101.33976 > 192.168.56.1.5001: UDP, length 1470
00:03:04.171675 IP 192.168.56.101.33976 > 192.168.56.1.5001: UDP, length 1470
00:03:04.197160 IP 192.168.56.101.33976 > 192.168.56.1.5001: UDP, length 1470
00:03:04.207960 IP 192.168.56.101.33976 > 192.168.56.1.5001: UDP, length 1470
00:03:04.220037 IP 192.168.56.101.33976 > 192.168.56.1.5001: UDP, length 1470
00:03:04.232108 IP 192.168.56.101.33976 > 192.168.56.1.5001: UDP, length 1470
00:03:04.256305 IP 192.168.56.101.33976 > 192.168.56.1.5001: UDP, length 1470
00:03:04.268395 IP 192.168.56.101.33976 > 192.168.56.1.5001: UDP, length 1470
00:03:04.280498 IP 192.168.56.101.33976 > 192.168.56.1.5001: UDP, length 1470
00:03:04.292659 IP 192.168.56.101.33976 > 192.168.56.1.5001: UDP, length 1470
00:03:04.317623 IP 192.168.56.101.33976 > 192.168.56.1.5001: UDP, length 1470
00:03:04.328880 IP 192.168.56.101.33976 > 192.168.56.1.5001: UDP, length 1470
00:03:04.341321 IP 192.168.56.101.33976 > 192.168.56.1.5001: UDP, length 1470
00:03:04.353144 IP 192.168.56.101.33976 > 192.168.56.1.5001: UDP, length 1470
00:03:04.377169 IP 192.168.56.101.33976 > 192.168.56.1.5001: UDP, length 1470
00:03:04.389251 IP 192.168.56.101.33976 > 192.168.56.1.5001: UDP, length 1470
00:03:04.403135 IP 192.168.56.101.33976 > 192.168.56.1.5001: UDP, length 1470
00:03:04.413609 IP 192.168.56.101.33976 > 192.168.56.1.5001: UDP, length 1470
00:03:04.437755 IP 192.168.56.101.33976 > 192.168.56.1.5001: UDP, length 1470
00:03:04.449866 IP 192.168.56.101.33976 > 192.168.56.1.5001: UDP, length 1470
00:03:04.463315 IP 192.168.56.101.33976 > 192.168.56.1.5001: UDP, length 1470
00:03:04.474888 IP 192.168.56.101.33976 > 192.168.56.1.5001: UDP, length 1470
00:03:04.498186 IP 192.168.56.101.33976 > 192.168.56.1.5001: UDP, length 1470
00:03:04.510240 IP 192.168.56.101.33976 > 192.168.56.1.5001: UDP, length 1470
00:03:04.522966 IP 192.168.56.101.33976 > 192.168.56.1.5001: UDP, length 1470
00:03:04.534407 IP 192.168.56.101.33976 > 192.168.56.1.5001: UDP, length 1470
00:03:04.558903 IP 192.168.56.101.33976 > 192.168.56.1.5001: UDP, length 1470
00:03:04.570715 IP 192.168.56.101.33976 > 192.168.56.1.5001: UDP, length 1470
00:03:04.583712 IP 192.168.56.101.33976 > 192.168.56.1.5001: UDP, length 1470
00:03:04.595128 IP 192.168.56.101.33976 > 192.168.56.1.5001: UDP, length 1470
00:03:04.619497 IP 192.168.56.101.33976 > 192.168.56.1.5001: UDP, length 1470
00:03:04.632796 IP 192.168.56.101.33976 > 192.168.56.1.5001: UDP, length 1470
00:03:04.644401 IP 192.168.56.101.33976 > 192.168.56.1.5001: UDP, length 1470
00:03:04.655720 IP 192.168.56.101.33976 > 192.168.56.1.5001: UDP, length 1470
00:03:04.681518 IP 192.168.56.101.33976 > 192.168.56.1.5001: UDP, length 1470
00:03:04.692709 IP 192.168.56.101.33976 > 192.168.56.1.5001: UDP, length 1470
00:03:04.703863 IP 192.168.56.101.33976 > 192.168.56.1.5001: UDP, length 1470
00:03:04.716772 IP 192.168.56.101.33976 > 192.168.56.1.5001: UDP, length 1470
00:03:04.740354 IP 192.168.56.101.33976 > 192.168.56.1.5001: UDP, length 1470
00:03:04.752455 IP 192.168.56.101.33976 > 192.168.56.1.5001: UDP, length 1470
00:03:04.764739 IP 192.168.56.101.33976 > 192.168.56.1.5001: UDP, length 1470
00:03:04.776273 IP 192.168.56.101.33976 > 192.168.56.1.5001: UDP, length 1470
00:03:04.800840 IP 192.168.56.101.33976 > 192.168.56.1.5001: UDP, length 1470
00:03:04.814311 IP 192.168.56.101.33976 > 192.168.56.1.5001: UDP, length 1470
00:03:04.824976 IP 192.168.56.101.33976 > 192.168.56.1.5001: UDP, length 1470
00:03:04.837172 IP 192.168.56.101.33976 > 192.168.56.1.5001: UDP, length 1470
00:03:04.861936 IP 192.168.56.101.33976 > 192.168.56.1.5001: UDP, length 1470
00:03:04.873895 IP 192.168.56.101.33976 > 192.168.56.1.5001: UDP, length 1470
00:03:04.886128 IP 192.168.56.101.33976 > 192.168.56.1.5001: UDP, length 1470
00:03:04.897708 IP 192.168.56.101.33976 > 192.168.56.1.5001: UDP, length 1470
00:03:04.921531 IP 192.168.56.101.33976 > 192.168.56.1.5001: UDP, length 1470
00:03:04.934865 IP 192.168.56.101.33976 > 192.168.56.1.5001: UDP, length 1470
00:03:04.946211 IP 192.168.56.101.33976 > 192.168.56.1.5001: UDP, length 1470
00:03:04.958618 IP 192.168.56.101.33976 > 192.168.56.1.5001: UDP, length 1470
00:03:04.982305 IP 192.168.56.101.33976 > 192.168.56.1.5001: UDP, length 1470
00:03:04.994214 IP 192.168.56.101.33976 > 192.168.56.1.5001: UDP, length 1470
00:03:05.006108 IP 192.168.56.101.33976 > 192.168.56.1.5001: UDP, length 1470
00:03:05.019459 IP 192.168.56.101.33976 > 192.168.56.1.5001: UDP, length 1470
00:03:05.042860 IP 192.168.56.101.33976 > 192.168.56.1.5001: UDP, length 1470
00:03:05.054855 IP 192.168.56.101.33976 > 192.168.56.1.5001: UDP, length 1470
00:03:05.067668 IP 192.168.56.101.33976 > 192.168.56.1.5001: UDP, length 1470
00:03:05.078656 IP 192.168.56.101.33976 > 192.168.56.1.5001: UDP, length 1470
00:03:05.103764 IP 192.168.56.101.33976 > 192.168.56.1.5001: UDP, length 1470
00:03:05.115074 IP 192.168.56.101.33976 > 192.168.56.1.5001: UDP, length 1470
00:03:05.127267 IP 192.168.56.101.33976 > 192.168.56.1.5001: UDP, length 1470
00:03:05.139218 IP 192.168.56.101.33976 > 192.168.56.1.5001: UDP, length 1470
00:03:05.163944 IP 192.168.56.101.33976 > 192.168.56.1.5001: UDP, length 1470
00:03:05.175805 IP 192.168.56.101.33976 > 192.168.56.1.5001: UDP, length 1470
00:03:05.188462 IP 192.168.56.101.33976 > 192.168.56.1.5001: UDP, length 1470
00:03:05.200189 IP 192.168.56.101.33976 > 192.168.56.1.5001: UDP, length 1470
00:03:05.224691 IP 192.168.56.101.33976 > 192.168.56.1.5001: UDP, length 1470
00:03:05.235994 IP 192.168.56.101.33976 > 192.168.56.1.5001: UDP, length 1470
00:03:05.248584 IP 192.168.56.101.33976 > 192.168.56.1.5001: UDP, length 1470
00:03:05.260115 IP 192.168.56.101.33976 > 192.168.56.1.5001: UDP, length 1470
00:03:05.284317 IP 192.168.56.101.33976 > 192.168.56.1.5001: UDP, length 1470
00:03:05.297539 IP 192.168.56.101.33976 > 192.168.56.1.5001: UDP, length 1470
00:03:05.308547 IP 192.168.56.101.33976 > 192.168.56.1.5001: UDP, length 1470
00:03:05.320603 IP 192.168.56.101.33976 > 192.168.56.1.5001: UDP, length 1470
00:03:05.344929 IP 192.168.56.101.33976 > 192.168.56.1.5001: UDP, length 1470
00:03:05.356888 IP 192.168.56.101.33976 > 192.168.56.1.5001: UDP, length 1470
00:03:05.369013 IP 192.168.56.101.33976 > 192.168.56.1.5001: UDP, length 1470
00:03:05.381093 IP 192.168.56.101.33976 > 192.168.56.1.5001: UDP, length 1470
00:03:05.405386 IP 192.168.56.101.33976 > 192.168.56.1.5001: UDP, length 1470
00:03:05.418650 IP 192.168.56.101.33976 > 192.168.56.1.5001: UDP, length 1470
00:03:05.430235 IP 192.168.56.101.33976 > 192.168.56.1.5001: UDP, length 1470
00:03:05.441637 IP 192.168.56.101.33976 > 192.168.56.1.5001: UDP, length 1470
00:03:05.465759 IP 192.168.56.101.33976 > 192.168.56.1.5001: UDP, length 1470
00:03:05.477848 IP 192.168.56.101.33976 > 192.168.56.1.5001: UDP, length 1470
00:03:05.489962 IP 192.168.56.101.33976 > 192.168.56.1.5001: UDP, length 1470
00:03:05.502100 IP 192.168.56.101.33976 > 192.168.56.1.5001: UDP, length 1470
00:03:05.527003 IP 192.168.56.101.33976 > 192.168.56.1.5001: UDP, length 1470
00:03:05.539184 IP 192.168.56.101.33976 > 192.168.56.1.5001: UDP, length 1470
00:03:05.551812 IP 192.168.56.101.33976 > 192.168.56.1.5001: UDP, length 1470
00:03:05.562862 IP 192.168.56.101.33976 > 192.168.56.1.5001: UDP, length 1470
00:03:05.588751 IP 192.168.56.101.33976 > 192.168.56.1.5001: UDP, length 1470
00:03:05.599174 IP 192.168.56.101.33976 > 192.168.56.1.5001: UDP, length 1470
00:03:05.611269 IP 192.168.56.101.33976 > 192.168.56.1.5001: UDP, length 1470
00:03:05.624789 IP 192.168.56.101.33976 > 192.168.56.1.5001: UDP, length 1470
00:03:05.648970 IP 192.168.56.101.33976 > 192.168.56.1.5001: UDP, length 1470
00:03:05.659771 IP 192.168.56.101.33976 > 192.168.56.1.5001: UDP, length 1470
00:03:05.671766 IP 192.168.56.101.33976 > 192.168.56.1.5001: UDP, length 1470
00:03:05.685667 IP 192.168.56.101.33976 > 192.168.56.1.5001: UDP, length 1470
00:03:05.709586 IP 192.168.56.101.33976 > 192.168.56.1.5001: UDP, length 1470
00:03:05.719984 IP 192.168.56.101.33976 > 192.168.56.1.5001: UDP, length 1470
00:03:05.732337 IP 192.168.56.101.33976 > 192.168.56.1.5001: UDP, length 1470
00:03:05.745841 IP 192.168.56.101.33976 > 192.168.56.1.5001: UDP, length 1470
00:03:05.768344 IP 192.168.56.101.33976 > 192.168.56.1.5001: UDP, length 1470
00:03:05.781278 IP 192.168.56.101.33976 > 192.168.56.1.5001: UDP, length 1470
00:03:05.794802 IP 192.168.56.101.33976 > 192.168.56.1.5001: UDP, length 1470
00:03:05.804967 IP 192.168.56.101.33976 > 192.168.56.1.5001: UDP, length 1470
00:03:05.828998 IP 192.168.56.101.33976 > 192.168.56.1.5001: UDP, length 1470
00:03:05.842723 IP 192.168.56.101.33976 > 192.168.56.1.5001: UDP, length 1470
00:03:05.853049 IP 192.168.56.101.33976 > 192.168.56.1.5001: UDP, length 1470
00:03:05.865414 IP 192.168.56.101.33976 > 192.168.56.1.5001: UDP, length 1470
00:03:05.889869 IP 192.168.56.101.33976 > 192.168.56.1.5001: UDP, length 1470
00:03:05.902088 IP 192.168.56.101.33976 > 192.168.56.1.5001: UDP, length 1470
00:03:05.915012 IP 192.168.56.101.33976 > 192.168.56.1.5001: UDP, length 1470
00:03:05.925847 IP 192.168.56.101.33976 > 192.168.56.1.5001: UDP, length 1470
00:03:05.951446 IP 192.168.56.101.33976 > 192.168.56.1.5001: UDP, length 1470
00:03:05.962141 IP 192.168.56.101.33976 > 192.168.56.1.5001: UDP, length 1470
00:03:05.976074 IP 192.168.56.101.33976 > 192.168.56.1.5001: UDP, length 1470
00:03:05.986298 IP 192.168.56.101.33976 > 192.168.56.1.5001: UDP, length 1470
00:03:06.010388 IP 192.168.56.101.33976 > 192.168.56.1.5001: UDP, length 1470
00:03:06.024193 IP 192.168.56.101.33976 > 192.168.56.1.5001: UDP, length 1470
00:03:06.034627 IP 192.168.56.101.33976 > 192.168.56.1.5001: UDP, length 1470
00:03:06.046793 IP 192.168.56.101.33976 > 192.168.56.1.5001: UDP, length 1470
00:03:06.072629 IP 192.168.56.101.33976 > 192.168.56.1.5001: UDP, length 1470
00:03:06.083859 IP 192.168.56.101.33976 > 192.168.56.1.5001: UDP, length 1470
00:03:06.094750 IP 192.168.56.101.33976 > 192.168.56.1.5001: UDP, length 1470
00:03:06.107916 IP 192.168.56.101.33976 > 192.168.56.1.5001: UDP, length 1470
00:03:06.131957 IP 192.168.56.101.33976 > 192.168.56.1.5001: UDP, length 1470
00:03:06.143410 IP 192.168.56.101.33976 > 192.168.56.1.5001: UDP, length 1470
00:03:06.155305 IP 192.168.56.101.33976 > 192.168.56.1.5001: UDP, length 1470
00:03:06.168989 IP 192.168.56.101.33976 > 192.168.56.1.5001: UDP, length 1470
00:03:06.192384 IP 192.168.56.101.33976 > 192.168.56.1.5001: UDP, length 1470
00:03:06.204781 IP 192.168.56.101.33976 > 192.168.56.1.5001: UDP, length 1470
00:03:06.216000 IP 192.168.56.101.33976 > 192.168.56.1.5001: UDP, length 1470
00:03:06.228237 IP 192.168.56.101.33976 > 192.168.56.1.5001: UDP, length 1470
00:03:06.252539 IP 192.168.56.101.33976 > 192.168.56.1.5001: UDP, length 1470
00:03:06.264186 IP 192.168.56.101.33976 > 192.168.56.1.5001: UDP, length 1470
00:03:06.276266 IP 192.168.56.101.33976 > 192.168.56.1.5001: UDP, length 1470
00:03:06.289196 IP 192.168.56.101.33976 > 192.168.56.1.5001: UDP, length 1470
00:03:06.313556 IP 192.168.56.101.33976 > 192.168.56.1.5001: UDP, length 1470
00:03:06.324679 IP 192.168.56.101.33976 > 192.168.56.1.5001: UDP, length 1470
00:03:06.337255 IP 192.168.56.101.33976 > 192.168.56.1.5001: UDP, length 1470
00:03:06.349354 IP 192.168.56.101.33976 > 192.168.56.1.5001: UDP, length 1470
00:03:06.373113 IP 192.168.56.101.33976 > 192.168.56.1.5001: UDP, length 1470
00:03:06.386391 IP 192.168.56.101.33976 > 192.168.56.1.5001: UDP, length 1470
00:03:06.397311 IP 192.168.56.101.33976 > 192.168.56.1.5001: UDP, length 1470
00:03:06.409366 IP 192.168.56.101.33976 > 192.168.56.1.5001: UDP, length 1470
00:03:06.433527 IP 192.168.56.101.33976 > 192.168.56.1.5001: UDP, length 1470
00:03:06.445623 IP 192.168.56.101.33976 > 192.168.56.1.5001: UDP, length 1470
00:03:06.457703 IP 192.168.56.101.33976 > 192.168.56.1.5001: UDP, length 1470
00:03:06.470932 IP 192.168.56.101.33976 > 192.168.56.1.5001: UDP, length 1470
00:03:06.494173 IP 192.168.56.101.33976 > 192.168.56.1.5001: UDP, length 1470
00:03:06.506113 IP 192.168.56.101.33976 > 192.168.56.1.5001: UDP, length 1470
00:03:06.518158 IP 192.168.56.101.33976 > 192.168.56.1.5001: UDP, length 1470
00:03:06.530141 IP 192.168.56.101.33976 > 192.168.56.1.5001: UDP, length 1470
00:03:06.554458 IP 192.168.56.101.33976 > 192.168.56.1.5001: UDP, length 1470
00:03:06.567531 IP 192.168.56.101.33976 > 192.168.56.1.5001: UDP, length 1470
00:03:06.579575 IP 192.168.56.101.33976 > 192.168.56.1.5001: UDP, length 1470
00:03:06.591003 IP 192.168.56.101.33976 > 192.168.56.1.5001: UDP, length 1470
00:03:06.615292 IP 192.168.56.101.33976 > 192.168.56.1.5001: UDP, length 1470
00:03:06.628546 IP 192.168.56.101.33976 > 192.168.56.1.5001: UDP, length 1470
00:03:06.639225 IP 192.168.56.101.33976 > 192.168.56.1.5001: UDP, length 1470
00:03:06.651543 IP 192.168.56.101.33976 > 192.168.56.1.5001: UDP, length 1470
00:03:06.675550 IP 192.168.56.101.33976 > 192.168.56.1.5001: UDP, length 1470
00:03:06.687721 IP 192.168.56.101.33976 > 192.168.56.1.5001: UDP, length 1470
00:03:06.699726 IP 192.168.56.101.33976 > 192.168.56.1.5001: UDP, length 1470
00:03:06.712314 IP 192.168.56.101.33976 > 192.168.56.1.5001: UDP, length 1470
00:03:06.736005 IP 192.168.56.101.33976 > 192.168.56.1.5001: UDP, length 1470
00:03:06.748394 IP 192.168.56.101.33976 > 192.168.56.1.5001: UDP, length 1470
00:03:06.760638 IP 192.168.56.101.33976 > 192.168.56.1.5001: UDP, length 1470
00:03:06.773738 IP 192.168.56.101.33976 > 192.168.56.1.5001: UDP, length 1470
00:03:06.798216 IP 192.168.56.101.33976 > 192.168.56.1.5001: UDP, length 1470
00:03:06.809162 IP 192.168.56.101.33976 > 192.168.56.1.5001: UDP, length 1470
00:03:06.821041 IP 192.168.56.101.33976 > 192.168.56.1.5001: UDP, length 1470
00:03:06.833431 IP 192.168.56.101.33976 > 192.168.56.1.5001: UDP, length 1470
00:03:06.857035 IP 192.168.56.101.33976 > 192.168.56.1.5001: UDP, length 1470
00:03:06.869082 IP 192.168.56.101.33976 > 192.168.56.1.5001: UDP, length 1470
00:03:06.882323 IP 192.168.56.101.33976 > 192.168.56.1.5001: UDP, length 1470
00:03:06.894313 IP 192.168.56.101.33976 > 192.168.56.1.5001: UDP, length 1470
00:03:06.917427 IP 192.168.56.101.33976 > 192.168.56.1.5001: UDP, length 1470
00:03:06.929859 IP 192.168.56.101.33976 > 192.168.56.1.5001: UDP, length 1470
00:03:06.942497 IP 192.168.56.101.33976 > 192.168.56.1.5001: UDP, length 1470
00:03:06.954002 IP 192.168.56.101.33976 > 192.168.56.1.5001: UDP, length 1470
00:03:06.977878 IP 192.168.56.101.33976 > 192.168.56.1.5001: UDP, length 1470
00:03:06.989739 IP 192.168.56.101.33976 > 192.168.56.1.5001: UDP, length 1470
00:03:07.002087 IP 192.168.56.101.33976 > 192.168.56.1.5001: UDP, length 1470
00:03:07.014331 IP 192.168.56.101.33976 > 192.168.56.1.5001: UDP, length 1470
00:03:07.038719 IP 192.168.56.101.33976 > 192.168.56.1.5001: UDP, length 1470
00:03:07.050459 IP 192.168.56.101.33976 > 192.168.56.1.5001: UDP, length 1470
00:03:07.062553 IP 192.168.56.101.33976 > 192.168.56.1.5001: UDP, length 1470
00:03:07.075407 IP 192.168.56.101.33976 > 192.168.56.1.5001: UDP, length 1470
00:03:07.098699 IP 192.168.56.101.33976 > 192.168.56.1.5001: UDP, length 1470
00:03:07.110996 IP 192.168.56.101.33976 > 192.168.56.1.5001: UDP, length 1470
00:03:07.123550 IP 192.168.56.101.33976 > 192.168.56.1.5001: UDP, length 1470
00:03:07.135888 IP 192.168.56.101.33976 > 192.168.56.1.5001: UDP, length 1470
00:03:07.159206 IP 192.168.56.101.33976 > 192.168.56.1.5001: UDP, length 1470
00:03:07.171320 IP 192.168.56.101.33976 > 192.168.56.1.5001: UDP, length 1470
00:03:07.183385 IP 192.168.56.101.33976 > 192.168.56.1.5001: UDP, length 1470
00:03:07.195627 IP 192.168.56.101.33976 > 192.168.56.1.5001: UDP, length 1470
00:03:07.220319 IP 192.168.56.101.33976 > 192.168.56.1.5001: UDP, length 1470
00:03:07.231862 IP 192.168.56.101.33976 > 192.168.56.1.5001: UDP, length 1470
00:03:07.244948 IP 192.168.56.101.33976 > 192.168.56.1.5001: UDP, length 1470
00:03:07.256041 IP 192.168.56.101.33976 > 192.168.56.1.5001: UDP, length 1470
00:03:07.280323 IP 192.168.56.101.33976 > 192.168.56.1.5001: UDP, length 1470
00:03:07.292869 IP 192.168.56.101.33976 > 192.168.56.1.5001: UDP, length 1470
00:03:07.304418 IP 192.168.56.101.33976 > 192.168.56.1.5001: UDP, length 1470
00:03:07.317511 IP 192.168.56.101.33976 > 192.168.56.1.5001: UDP, length 1470
00:03:07.341064 IP 192.168.56.101.33976 > 192.168.56.1.5001: UDP, length 1470
00:03:07.353141 IP 192.168.56.101.33976 > 192.168.56.1.5001: UDP, length 1470
00:03:07.365276 IP 192.168.56.101.33976 > 192.168.56.1.5001: UDP, length 1470
00:03:07.379212 IP 192.168.56.101.33976 > 192.168.56.1.5001: UDP, length 1470
00:03:07.401548 IP 192.168.56.101.33976 > 192.168.56.1.5001: UDP, length 1470
00:03:07.414488 IP 192.168.56.101.33976 > 192.168.56.1.5001: UDP, length 1470
00:03:07.426008 IP 192.168.56.101.33976 > 192.168.56.1.5001: UDP, length 1470
00:03:07.439262 IP 192.168.56.101.33976 > 192.168.56.1.5001: UDP, length 1470
00:03:07.462616 IP 192.168.56.101.33976 > 192.168.56.1.5001: UDP, length 1470
00:03:07.473883 IP 192.168.56.101.33976 > 192.168.56.1.5001: UDP, length 1470
00:03:07.487629 IP 192.168.56.101.33976 > 192.168.56.1.5001: UDP, length 1470
00:03:07.498065 IP 192.168.56.101.33976 > 192.168.56.1.5001: UDP, length 1470
00:03:07.523184 IP 192.168.56.101.33976 > 192.168.56.1.5001: UDP, length 1470
00:03:07.534550 IP 192.168.56.101.33976 > 192.168.56.1.5001: UDP, length 1470
00:03:07.546381 IP 192.168.56.101.33976 > 192.168.56.1.5001: UDP, length 1470
00:03:07.559904 IP 192.168.56.101.33976 > 192.168.56.1.5001: UDP, length 1470
00:03:07.582702 IP 192.168.56.101.33976 > 192.168.56.1.5001: UDP, length 1470
00:03:07.594789 IP 192.168.56.101.33976 > 192.168.56.1.5001: UDP, length 1470
00:03:07.607759 IP 192.168.56.101.33976 > 192.168.56.1.5001: UDP, length 1470
00:03:07.620436 IP 192.168.56.101.33976 > 192.168.56.1.5001: UDP, length 1470
00:03:07.644522 IP 192.168.56.101.33976 > 192.168.56.1.5001: UDP, length 1470
00:03:07.655843 IP 192.168.56.101.33976 > 192.168.56.1.5001: UDP, length 1470
00:03:07.668715 IP 192.168.56.101.33976 > 192.168.56.1.5001: UDP, length 1470
00:03:07.679555 IP 192.168.56.101.33976 > 192.168.56.1.5001: UDP, length 1470
00:03:07.703656 IP 192.168.56.101.33976 > 192.168.56.1.5001: UDP, length 1470
00:03:07.715624 IP 192.168.56.101.33976 > 192.168.56.1.5001: UDP, length 1470
00:03:07.728474 IP 192.168.56.101.33976 > 192.168.56.1.5001: UDP, length 1470
00:03:07.740069 IP 192.168.56.101.33976 > 192.168.56.1.5001: UDP, length 1470
00:03:07.764177 IP 192.168.56.101.33976 > 192.168.56.1.5001: UDP, length 1470
00:03:07.776190 IP 192.168.56.101.33976 > 192.168.56.1.5001: UDP, length 1470
00:03:07.789928 IP 192.168.56.101.33976 > 192.168.56.1.5001: UDP, length 1470
00:03:07.800524 IP 192.168.56.101.33976 > 192.168.56.1.5001: UDP, length 1470
00:03:07.824679 IP 192.168.56.101.33976 > 192.168.56.1.5001: UDP, length 1470
00:03:07.836621 IP 192.168.56.101.33976 > 192.168.56.1.5001: UDP, length 1470
00:03:07.849078 IP 192.168.56.101.33976 > 192.168.56.1.5001: UDP, length 1470
00:03:07.860811 IP 192.168.56.101.33976 > 192.168.56.1.5001: UDP, length 1470
00:03:07.885632 IP 192.168.56.101.33976 > 192.168.56.1.5001: UDP, length 1470
00:03:07.897069 IP 192.168.56.101.33976 > 192.168.56.1.5001: UDP, length 1470
00:03:07.909186 IP 192.168.56.101.33976 > 192.168.56.1.5001: UDP, length 1470
00:03:07.921334 IP 192.168.56.101.33976 > 192.168.56.1.5001: UDP, length 1470
00:03:07.945946 IP 192.168.56.101.33976 > 192.168.56.1.5001: UDP, length 1470
00:03:07.957805 IP 192.168.56.101.33976 > 192.168.56.1.5001: UDP, length 1470
00:03:07.969755 IP 192.168.56.101.33976 > 192.168.56.1.5001: UDP, length 1470
00:03:07.983234 IP 192.168.56.101.33976 > 192.168.56.1.5001: UDP, length 1470
00:03:08.007818 IP 192.168.56.101.33976 > 192.168.56.1.5001: UDP, length 1470
00:03:08.018262 IP 192.168.56.101.33976 > 192.168.56.1.5001: UDP, length 1470
00:03:08.031391 IP 192.168.56.101.33976 > 192.168.56.1.5001: UDP, length 1470
00:03:08.043157 IP 192.168.56.101.33976 > 192.168.56.1.5001: UDP, length 1470
00:03:08.066725 IP 192.168.56.101.33976 > 192.168.56.1.5001: UDP, length 1470
00:03:08.078521 IP 192.168.56.101.33976 > 192.168.56.1.5001: UDP, length 1470
00:03:08.090656 IP 192.168.56.101.33976 > 192.168.56.1.5001: UDP, length 1470
00:03:08.102722 IP 192.168.56.101.33976 > 192.168.56.1.5001: UDP, length 1470
00:03:08.127614 IP 192.168.56.101.33976 > 192.168.56.1.5001: UDP, length 1470
00:03:08.138985 IP 192.168.56.101.33976 > 192.168.56.1.5001: UDP, length 1470
00:03:08.151136 IP 192.168.56.101.33976 > 192.168.56.1.5001: UDP, length 1470
00:03:08.163509 IP 192.168.56.101.33976 > 192.168.56.1.5001: UDP, length 1470
00:03:08.187374 IP 192.168.56.101.33976 > 192.168.56.1.5001: UDP, length 1470
00:03:08.199622 IP 192.168.56.101.33976 > 192.168.56.1.5001: UDP, length 1470
00:03:08.211828 IP 192.168.56.101.33976 > 192.168.56.1.5001: UDP, length 1470
00:03:08.224238 IP 192.168.56.101.33976 > 192.168.56.1.5001: UDP, length 1470
00:03:08.247855 IP 192.168.56.101.33976 > 192.168.56.1.5001: UDP, length 1470
00:03:08.259997 IP 192.168.56.101.33976 > 192.168.56.1.5001: UDP, length 1470
00:03:08.273651 IP 192.168.56.101.33976 > 192.168.56.1.5001: UDP, length 1470
00:03:08.284440 IP 192.168.56.101.33976 > 192.168.56.1.5001: UDP, length 1470
00:03:08.308730 IP 192.168.56.101.33976 > 192.168.56.1.5001: UDP, length 1470
00:03:08.320412 IP 192.168.56.101.33976 > 192.168.56.1.5001: UDP, length 1470
00:03:08.333366 IP 192.168.56.101.33976 > 192.168.56.1.5001: UDP, length 1470
00:03:08.344737 IP 192.168.56.101.33976 > 192.168.56.1.5001: UDP, length 1470
00:03:08.368837 IP 192.168.56.101.33976 > 192.168.56.1.5001: UDP, length 1470
00:03:08.382203 IP 192.168.56.101.33976 > 192.168.56.1.5001: UDP, length 1470
00:03:08.393786 IP 192.168.56.101.33976 > 192.168.56.1.5001: UDP, length 1470
00:03:08.405138 IP 192.168.56.101.33976 > 192.168.56.1.5001: UDP, length 1470
00:03:08.430125 IP 192.168.56.101.33976 > 192.168.56.1.5001: UDP, length 1470
00:03:08.441482 IP 192.168.56.101.33976 > 192.168.56.1.5001: UDP, length 1470
00:03:08.454065 IP 192.168.56.101.33976 > 192.168.56.1.5001: UDP, length 1470
00:03:08.465890 IP 192.168.56.101.33976 > 192.168.56.1.5001: UDP, length 1470
00:03:08.489989 IP 192.168.56.101.33976 > 192.168.56.1.5001: UDP, length 1470
00:03:08.501916 IP 192.168.56.101.33976 > 192.168.56.1.5001: UDP, length 1470
00:03:08.513987 IP 192.168.56.101.33976 > 192.168.56.1.5001: UDP, length 1470
00:03:08.527209 IP 192.168.56.101.33976 > 192.168.56.1.5001: UDP, length 1470
00:03:08.550248 IP 192.168.56.101.33976 > 192.168.56.1.5001: UDP, length 1470
00:03:08.562656 IP 192.168.56.101.33976 > 192.168.56.1.5001: UDP, length 1470
00:03:08.574503 IP 192.168.56.101.33976 > 192.168.56.1.5001: UDP, length 1470
00:03:08.586592 IP 192.168.56.101.33976 > 192.168.56.1.5001: UDP, length 1470
00:03:08.610726 IP 192.168.56.101.33976 > 192.168.56.1.5001: UDP, length 1470
00:03:08.622897 IP 192.168.56.101.33976 > 192.168.56.1.5001: UDP, length 1470
00:03:08.635106 IP 192.168.56.101.33976 > 192.168.56.1.5001: UDP, length 1470
00:03:08.647270 IP 192.168.56.101.33976 > 192.168.56.1.5001: UDP, length 1470
00:03:08.671480 IP 192.168.56.101.33976 > 192.168.56.1.5001: UDP, length 1470
00:03:08.683620 IP 192.168.56.101.33976 > 192.168.56.1.5001: UDP, length 1470
00:03:08.695976 IP 192.168.56.101.33976 > 192.168.56.1.5001: UDP, length 1470
00:03:08.707833 IP 192.168.56.101.33976 > 192.168.56.1.5001: UDP, length 1470
00:03:08.732648 IP 192.168.56.101.33976 > 192.168.56.1.5001: UDP, length 1470
00:03:08.744735 IP 192.168.56.101.33976 > 192.168.56.1.5001: UDP, length 1470
00:03:08.756519 IP 192.168.56.101.33976 > 192.168.56.1.5001: UDP, length 1470
00:03:08.768255 IP 192.168.56.101.33976 > 192.168.56.1.5001: UDP, length 1470
00:03:08.793142 IP 192.168.56.101.33976 > 192.168.56.1.5001: UDP, length 1470
00:03:08.805336 IP 192.168.56.101.33976 > 192.168.56.1.5001: UDP, length 1470
00:03:08.816603 IP 192.168.56.101.33976 > 192.168.56.1.5001: UDP, length 1470
00:03:08.828418 IP 192.168.56.101.33976 > 192.168.56.1.5001: UDP, length 1470
00:03:08.852930 IP 192.168.56.101.33976 > 192.168.56.1.5001: UDP, length 1470
00:03:08.865270 IP 192.168.56.101.33976 > 192.168.56.1.5001: UDP, length 1470
00:03:08.876975 IP 192.168.56.101.33976 > 192.168.56.1.5001: UDP, length 1470
00:03:08.889865 IP 192.168.56.101.33976 > 192.168.56.1.5001: UDP, length 1470
00:03:08.913178 IP 192.168.56.101.33976 > 192.168.56.1.5001: UDP, length 1470
00:03:08.926538 IP 192.168.56.101.33976 > 192.168.56.1.5001: UDP, length 1470
00:03:08.938123 IP 192.168.56.101.33976 > 192.168.56.1.5001: UDP, length 1470
00:03:08.949866 IP 192.168.56.101.33976 > 192.168.56.1.5001: UDP, length 1470
00:03:08.975531 IP 192.168.56.101.33976 > 192.168.56.1.5001: UDP, length 1470
00:03:08.985870 IP 192.168.56.101.33976 > 192.168.56.1.5001: UDP, length 1470
00:03:08.997968 IP 192.168.56.101.33976 > 192.168.56.1.5001: UDP, length 1470
00:03:09.010232 IP 192.168.56.101.33976 > 192.168.56.1.5001: UDP, length 1470
00:03:09.034386 IP 192.168.56.101.33976 > 192.168.56.1.5001: UDP, length 1470
00:03:09.047011 IP 192.168.56.101.33976 > 192.168.56.1.5001: UDP, length 1470
00:03:09.059569 IP 192.168.56.101.33976 > 192.168.56.1.5001: UDP, length 1470
00:03:09.070830 IP 192.168.56.101.33976 > 192.168.56.1.5001: UDP, length 1470
00:03:09.095475 IP 192.168.56.101.33976 > 192.168.56.1.5001: UDP, length 1470
00:03:09.106869 IP 192.168.56.101.33976 > 192.168.56.1.5001: UDP, length 1470
00:03:09.119630 IP 192.168.56.101.33976 > 192.168.56.1.5001: UDP, length 1470
00:03:09.130834 IP 192.168.56.101.33976 > 192.168.56.1.5001: UDP, length 1470
00:03:09.155035 IP 192.168.56.101.33976 > 192.168.56.1.5001: UDP, length 1470
00:03:09.167997 IP 192.168.56.101.33976 > 192.168.56.1.5001: UDP, length 1470
00:03:09.179343 IP 192.168.56.101.33976 > 192.168.56.1.5001: UDP, length 1470
00:03:09.191499 IP 192.168.56.101.33976 > 192.168.56.1.5001: UDP, length 1470
00:03:09.215661 IP 192.168.56.101.33976 > 192.168.56.1.5001: UDP, length 1470
00:03:09.228315 IP 192.168.56.101.33976 > 192.168.56.1.5001: UDP, length 1470
00:03:09.240151 IP 192.168.56.101.33976 > 192.168.56.1.5001: UDP, length 1470
00:03:09.251943 IP 192.168.56.101.33976 > 192.168.56.1.5001: UDP, length 1470
00:03:09.275975 IP 192.168.56.101.33976 > 192.168.56.1.5001: UDP, length 1470
00:03:09.288997 IP 192.168.56.101.33976 > 192.168.56.1.5001: UDP, length 1470
00:03:09.300231 IP 192.168.56.101.33976 > 192.168.56.1.5001: UDP, length 1470
00:03:09.312859 IP 192.168.56.101.33976 > 192.168.56.1.5001: UDP, length 1470
00:03:09.336477 IP 192.168.56.101.33976 > 192.168.56.1.5001: UDP, length 1470
00:03:09.348713 IP 192.168.56.101.33976 > 192.168.56.1.5001: UDP, length 1470
00:03:09.360800 IP 192.168.56.101.33976 > 192.168.56.1.5001: UDP, length 1470
00:03:09.372694 IP 192.168.56.101.33976 > 192.168.56.1.5001: UDP, length 1470
00:03:09.396982 IP 192.168.56.101.33976 > 192.168.56.1.5001: UDP, length 1470
00:03:09.409389 IP 192.168.56.101.33976 > 192.168.56.1.5001: UDP, length 1470
00:03:09.422047 IP 192.168.56.101.33976 > 192.168.56.1.5001: UDP, length 1470
00:03:09.433300 IP 192.168.56.101.33976 > 192.168.56.1.5001: UDP, length 1470
00:03:09.457542 IP 192.168.56.101.33976 > 192.168.56.1.5001: UDP, length 1470
00:03:09.469658 IP 192.168.56.101.33976 > 192.168.56.1.5001: UDP, length 1470
00:03:09.481708 IP 192.168.56.101.33976 > 192.168.56.1.5001: UDP, length 1470
00:03:09.494223 IP 192.168.56.101.33976 > 192.168.56.1.5001: UDP, length 1470
00:03:09.517988 IP 192.168.56.101.33976 > 192.168.56.1.5001: UDP, length 1470
00:03:09.530045 IP 192.168.56.101.33976 > 192.168.56.1.5001: UDP, length 1470
00:03:09.543090 IP 192.168.56.101.33976 > 192.168.56.1.5001: UDP, length 1470
00:03:09.555021 IP 192.168.56.101.33976 > 192.168.56.1.5001: UDP, length 1470
00:03:09.578840 IP 192.168.56.101.33976 > 192.168.56.1.5001: UDP, length 1470
00:03:09.590797 IP 192.168.56.101.33976 > 192.168.56.1.5001: UDP, length 1470
00:03:09.602619 IP 192.168.56.101.33976 > 192.168.56.1.5001: UDP, length 1470
00:03:09.614634 IP 192.168.56.101.33976 > 192.168.56.1.5001: UDP, length 1470
00:03:09.639709 IP 192.168.56.101.33976 > 192.168.56.1.5001: UDP, length 1470
00:03:09.651317 IP 192.168.56.101.33976 > 192.168.56.1.5001: UDP, length 1470
00:03:09.663130 IP 192.168.56.101.33976 > 192.168.56.1.5001: UDP, length 1470
00:03:09.675218 IP 192.168.56.101.33976 > 192.168.56.1.5001: UDP, length 1470
00:03:09.699336 IP 192.168.56.101.33976 > 192.168.56.1.5001: UDP, length 1470
00:03:09.711397 IP 192.168.56.101.33976 > 192.168.56.1.5001: UDP, length 1470
00:03:09.724306 IP 192.168.56.101.33976 > 192.168.56.1.5001: UDP, length 1470
00:03:09.735993 IP 192.168.56.101.33976 > 192.168.56.1.5001: UDP, length 1470
00:03:09.760393 IP 192.168.56.101.33976 > 192.168.56.1.5001: UDP, length 1470
00:03:09.772125 IP 192.168.56.101.33976 > 192.168.56.1.5001: UDP, length 1470
00:03:09.784817 IP 192.168.56.101.33976 > 192.168.56.1.5001: UDP, length 1470
00:03:09.796344 IP 192.168.56.101.33976 > 192.168.56.1.5001: UDP, length 1470
00:03:09.820723 IP 192.168.56.101.33976 > 192.168.56.1.5001: UDP, length 1470
00:03:09.833295 IP 192.168.56.101.33976 > 192.168.56.1.5001: UDP, length 1470
00:03:09.845008 IP 192.168.56.101.33976 > 192.168.56.1.5001: UDP, length 1470
00:03:09.857662 IP 192.168.56.101.33976 > 192.168.56.1.5001: UDP, length 1470
00:03:09.881153 IP 192.168.56.101.33976 > 192.168.56.1.5001: UDP, length 1470
00:03:09.892908 IP 192.168.56.101.33976 > 192.168.56.1.5001: UDP, length 1470
00:03:09.906279 IP 192.168.56.101.33976 > 192.168.56.1.5001: UDP, length 1470
00:03:09.918071 IP 192.168.56.101.33976 > 192.168.56.1.5001: UDP, length 1470
00:03:09.941665 IP 192.168.56.101.33976 > 192.168.56.1.5001: UDP, length 1470
00:03:09.954060 IP 192.168.56.101.33976 > 192.168.56.1.5001: UDP, length 1470
00:03:09.965624 IP 192.168.56.101.33976 > 192.168.56.1.5001: UDP, length 1470
00:03:09.978907 IP 192.168.56.101.33976 > 192.168.56.1.5001: UDP, length 1470
00:03:10.002022 IP 192.168.56.101.33976 > 192.168.56.1.5001: UDP, length 1470
00:03:10.015360 IP 192.168.56.101.33976 > 192.168.56.1.5001: UDP, length 1470
00:03:10.026222 IP 192.168.56.101.33976 > 192.168.56.1.5001: UDP, length 1470
00:03:10.039731 IP 192.168.56.101.33976 > 192.168.56.1.5001: UDP, length 1470
00:03:10.062602 IP 192.168.56.101.33976 > 192.168.56.1.5001: UDP, length 1470
00:03:10.076376 IP 192.168.56.101.33976 > 192.168.56.1.5001: UDP, length 1470
00:03:10.086532 IP 192.168.56.101.33976 > 192.168.56.1.5001: UDP, length 1470
00:03:10.098918 IP 192.168.56.101.33976 > 192.168.56.1.5001: UDP, length 1470
00:03:10.123167 IP 192.168.56.101.33976 > 192.168.56.1.5001: UDP, length 1470
00:03:10.136079 IP 192.168.56.101.33976 > 192.168.56.1.5001: UDP, length 1470
00:03:10.148066 IP 192.168.56.101.33976 > 192.168.56.1.5001: UDP, length 1470
00:03:10.160322 IP 192.168.56.101.33976 > 192.168.56.1.5001: UDP, length 1470
00:03:10.183564 IP 192.168.56.101.33976 > 192.168.56.1.5001: UDP, length 1470
00:03:10.195653 IP 192.168.56.101.33976 > 192.168.56.1.5001: UDP, length 1470
00:03:10.208831 IP 192.168.56.101.33976 > 192.168.56.1.5001: UDP, length 1470
00:03:10.220379 IP 192.168.56.101.33976 > 192.168.56.1.5001: UDP, length 1470
00:03:10.244328 IP 192.168.56.101.33976 > 192.168.56.1.5001: UDP, length 1470
00:03:10.256164 IP 192.168.56.101.33976 > 192.168.56.1.5001: UDP, length 1470
00:03:10.268560 IP 192.168.56.101.33976 > 192.168.56.1.5001: UDP, length 1470
00:03:10.280651 IP 192.168.56.101.33976 > 192.168.56.1.5001: UDP, length 1470
00:03:10.305308 IP 192.168.56.101.33976 > 192.168.56.1.5001: UDP, length 1470
00:03:10.317039 IP 192.168.56.101.33976 > 192.168.56.1.5001: UDP, length 1470
00:03:10.328695 IP 192.168.56.101.33976 > 192.168.56.1.5001: UDP, length 1470
00:03:10.340712 IP 192.168.56.101.33976 > 192.168.56.1.5001: UDP, length 1470
00:03:10.365702 IP 192.168.56.101.33976 > 192.168.56.1.5001: UDP, length 1470
00:03:10.377841 IP 192.168.56.101.33976 > 192.168.56.1.5001: UDP, length 1470
00:03:10.389588 IP 192.168.56.101.33976 > 192.168.56.1.5001: UDP, length 1470
00:03:10.401035 IP 192.168.56.101.33976 > 192.168.56.1.5001: UDP, length 1470
00:03:10.425343 IP 192.168.56.101.33976 > 192.168.56.1.5001: UDP, length 1470
00:03:10.439421 IP 192.168.56.101.33976 > 192.168.56.1.5001: UDP, length 1470
00:03:10.449462 IP 192.168.56.101.33976 > 192.168.56.1.5001: UDP, length 1470
00:03:10.461811 IP 192.168.56.101.33976 > 192.168.56.1.5001: UDP, length 1470
00:03:10.486094 IP 192.168.56.101.33976 > 192.168.56.1.5001: UDP, length 1470
00:03:10.498332 IP 192.168.56.101.33976 > 192.168.56.1.5001: UDP, length 1470
00:03:10.509881 IP 192.168.56.101.33976 > 192.168.56.1.5001: UDP, length 1470
00:03:10.521959 IP 192.168.56.101.33976 > 192.168.56.1.5001: UDP, length 1470
00:03:10.546901 IP 192.168.56.101.33976 > 192.168.56.1.5001: UDP, length 1470
00:03:10.558505 IP 192.168.56.101.33976 > 192.168.56.1.5001: UDP, length 1470
00:03:10.571357 IP 192.168.56.101.33976 > 192.168.56.1.5001: UDP, length 1470
00:03:10.582447 IP 192.168.56.101.33976 > 192.168.56.1.5001: UDP, length 1470
00:03:10.606748 IP 192.168.56.101.33976 > 192.168.56.1.5001: UDP, length 1470
00:03:10.619631 IP 192.168.56.101.33976 > 192.168.56.1.5001: UDP, length 1470
00:03:10.631349 IP 192.168.56.101.33976 > 192.168.56.1.5001: UDP, length 1470
00:03:10.642940 IP 192.168.56.101.33976 > 192.168.56.1.5001: UDP, length 1470
00:03:10.667513 IP 192.168.56.101.33976 > 192.168.56.1.5001: UDP, length 1470
00:03:10.681071 IP 192.168.56.101.33976 > 192.168.56.1.5001: UDP, length 1470
00:03:10.691714 IP 192.168.56.101.33976 > 192.168.56.1.5001: UDP, length 1470
00:03:10.705091 IP 192.168.56.101.33976 > 192.168.56.1.5001: UDP, length 1470
00:03:10.727653 IP 192.168.56.101.33976 > 192.168.56.1.5001: UDP, length 1470
00:03:10.739878 IP 192.168.56.101.33976 > 192.168.56.1.5001: UDP, length 1470
00:03:10.751750 IP 192.168.56.101.33976 > 192.168.56.1.5001: UDP, length 1470
00:03:10.763894 IP 192.168.56.101.33976 > 192.168.56.1.5001: UDP, length 1470
00:03:10.788139 IP 192.168.56.101.33976 > 192.168.56.1.5001: UDP, length 1470
00:03:10.800171 IP 192.168.56.101.33976 > 192.168.56.1.5001: UDP, length 1470
00:03:10.812197 IP 192.168.56.101.33976 > 192.168.56.1.5001: UDP, length 1470
00:03:10.824417 IP 192.168.56.101.33976 > 192.168.56.1.5001: UDP, length 1470
00:03:10.848785 IP 192.168.56.101.33976 > 192.168.56.1.5001: UDP, length 1470
00:03:10.860566 IP 192.168.56.101.33976 > 192.168.56.1.5001: UDP, length 1470
00:03:10.872737 IP 192.168.56.101.33976 > 192.168.56.1.5001: UDP, length 1470
00:03:10.884924 IP 192.168.56.101.33976 > 192.168.56.1.5001: UDP, length 1470
00:03:10.909417 IP 192.168.56.101.33976 > 192.168.56.1.5001: UDP, length 1470
00:03:10.921083 IP 192.168.56.101.33976 > 192.168.56.1.5001: UDP, length 1470
00:03:10.933152 IP 192.168.56.101.33976 > 192.168.56.1.5001: UDP, length 1470
00:03:10.945466 IP 192.168.56.101.33976 > 192.168.56.1.5001: UDP, length 1470
00:03:10.969542 IP 192.168.56.101.33976 > 192.168.56.1.5001: UDP, length 1470
00:03:10.981658 IP 192.168.56.101.33976 > 192.168.56.1.5001: UDP, length 1470
00:03:10.994238 IP 192.168.56.101.33976 > 192.168.56.1.5001: UDP, length 1470
00:03:11.005900 IP 192.168.56.101.33976 > 192.168.56.1.5001: UDP, length 1470
00:03:11.030362 IP 192.168.56.101.33976 > 192.168.56.1.5001: UDP, length 1470
00:03:11.042026 IP 192.168.56.101.33976 > 192.168.56.1.5001: UDP, length 1470
00:03:11.054553 IP 192.168.56.101.33976 > 192.168.56.1.5001: UDP, length 1470
00:03:11.066212 IP 192.168.56.101.33976 > 192.168.56.1.5001: UDP, length 1470
00:03:11.091694 IP 192.168.56.101.33976 > 192.168.56.1.5001: UDP, length 1470
00:03:11.103269 IP 192.168.56.101.33976 > 192.168.56.1.5001: UDP, length 1470
00:03:11.114728 IP 192.168.56.101.33976 > 192.168.56.1.5001: UDP, length 1470
00:03:11.126822 IP 192.168.56.101.33976 > 192.168.56.1.5001: UDP, length 1470
00:03:11.152037 IP 192.168.56.101.33976 > 192.168.56.1.5001: UDP, length 1470
00:03:11.163224 IP 192.168.56.101.33976 > 192.168.56.1.5001: UDP, length 1470
00:03:11.175328 IP 192.168.56.101.33976 > 192.168.56.1.5001: UDP, length 1470
00:03:11.187330 IP 192.168.56.101.33976 > 192.168.56.1.5001: UDP, length 1470
00:03:11.212655 IP 192.168.56.101.33976 > 192.168.56.1.5001: UDP, length 1470
00:03:11.223860 IP 192.168.56.101.33976 > 192.168.56.1.5001: UDP, length 1470
00:03:11.236421 IP 192.168.56.101.33976 > 192.168.56.1.5001: UDP, length 1470
00:03:11.248767 IP 192.168.56.101.33976 > 192.168.56.1.5001: UDP, length 1470
00:03:11.271904 IP 192.168.56.101.33976 > 192.168.56.1.5001: UDP, length 1470
00:03:11.285531 IP 192.168.56.101.33976 > 192.168.56.1.5001: UDP, length 1470
00:03:11.297210 IP 192.168.56.101.33976 > 192.168.56.1.5001: UDP, length 1470
00:03:11.309314 IP 192.168.56.101.33976 > 192.168.56.1.5001: UDP, length 1470
00:03:11.332734 IP 192.168.56.101.33976 > 192.168.56.1.5001: UDP, length 1470
00:03:11.344697 IP 192.168.56.101.33976 > 192.168.56.1.5001: UDP, length 1470
00:03:11.356682 IP 192.168.56.101.33976 > 192.168.56.1.5001: UDP, length 1470
00:03:11.369519 IP 192.168.56.101.33976 > 192.168.56.1.5001: UDP, length 1470
00:03:11.392882 IP 192.168.56.101.33976 > 192.168.56.1.5001: UDP, length 1470
00:03:11.404983 IP 192.168.56.101.33976 > 192.168.56.1.5001: UDP, length 1470
00:03:11.417930 IP 192.168.56.101.33976 > 192.168.56.1.5001: UDP, length 1470
00:03:11.429931 IP 192.168.56.101.33976 > 192.168.56.1.5001: UDP, length 1470
