00:47:25.931046 IP 192.168.56.101.47489 > 192.168.56.1.5001: UDP, length 1470
00:47:26.052078 IP 192.168.56.101.47489 > 192.168.56.1.5001: UDP, length 1470
00:47:26.295662 IP 192.168.56.101.47489 > 192.168.56.1.5001: UDP, length 1470
00:47:26.415055 IP 192.168.56.101.47489 > 192.168.56.1.5001: UDP, length 1470
00:47:26.536875 IP 192.168.56.101.47489 > 192.168.56.1.5001: UDP, length 1470
00:47:26.778129 IP 192.168.56.101.47489 > 192.168.56.1.5001: UDP, length 1470
00:47:26.899974 IP 192.168.56.101.47489 > 192.168.56.1.5001: UDP, length 1470
00:47:27.019908 IP 192.168.56.101.47489 > 192.168.56.1.5001: UDP, length 1470
00:47:27.140939 IP 192.168.56.101.47489 > 192.168.56.1.5001: UDP, length 1470
00:47:27.383036 IP 192.168.56.101.47489 > 192.168.56.1.5001: UDP, length 1470
00:47:27.503906 IP 192.168.56.101.47489 > 192.168.56.1.5001: UDP, length 1470
00:47:27.624650 IP 192.168.56.101.47489 > 192.168.56.1.5001: UDP, length 1470
00:47:27.746265 IP 192.168.56.101.47489 > 192.168.56.1.5001: UDP, length 1470
00:47:27.988152 IP 192.168.56.101.47489 > 192.168.56.1.5001: UDP, length 1470
00:47:28.108811 IP 192.168.56.101.47489 > 192.168.56.1.5001: UDP, length 1470
00:47:28.230278 IP 192.168.56.101.47489 > 192.168.56.1.5001: UDP, length 1470
00:47:28.350731 IP 192.168.56.101.47489 > 192.168.56.1.5001: UDP, length 1470
00:47:28.592766 IP 192.168.56.101.47489 > 192.168.56.1.5001: UDP, length 1470
00:47:28.715540 IP 192.168.56.101.47489 > 192.168.56.1.5001: UDP, length 1470
00:47:28.834624 IP 192.168.56.101.47489 > 192.168.56.1.5001: UDP, length 1470
00:47:28.955632 IP 192.168.56.101.47489 > 192.168.56.1.5001: UDP, length 1470
00:47:29.198867 IP 192.168.56.101.47489 > 192.168.56.1.5001: UDP, length 1470
00:47:29.318112 IP 192.168.56.101.47489 > 192.168.56.1.5001: UDP, length 1470
00:47:29.439207 IP 192.168.56.101.47489 > 192.168.56.1.5001: UDP, length 1470
00:47:29.560489 IP 192.168.56.101.47489 > 192.168.56.1.5001: UDP, length 1470
00:47:29.802046 IP 192.168.56.101.47489 > 192.168.56.1.5001: UDP, length 1470
00:47:29.923726 IP 192.168.56.101.47489 > 192.168.56.1.5001: UDP, length 1470
00:47:30.044125 IP 192.168.56.101.47489 > 192.168.56.1.5001: UDP, length 1470
00:47:30.165703 IP 192.168.56.101.47489 > 192.168.56.1.5001: UDP, length 1470
00:47:30.407552 IP 192.168.56.101.47489 > 192.168.56.1.5001: UDP, length 1470
00:47:30.528564 IP 192.168.56.101.47489 > 192.168.56.1.5001: UDP, length 1470
00:47:30.649014 IP 192.168.56.101.47489 > 192.168.56.1.5001: UDP, length 1470
00:47:30.771408 IP 192.168.56.101.47489 > 192.168.56.1.5001: UDP, length 1470
00:47:31.013383 IP 192.168.56.101.47489 > 192.168.56.1.5001: UDP, length 1470
00:47:31.134189 IP 192.168.56.101.47489 > 192.168.56.1.5001: UDP, length 1470
00:47:31.254342 IP 192.168.56.101.47489 > 192.168.56.1.5001: UDP, length 1470
00:47:31.374896 IP 192.168.56.101.47489 > 192.168.56.1.5001: UDP, length 1470
00:47:31.616398 IP 192.168.56.101.47489 > 192.168.56.1.5001: UDP, length 1470
00:47:31.737468 IP 192.168.56.101.47489 > 192.168.56.1.5001: UDP, length 1470
00:47:31.858251 IP 192.168.56.101.47489 > 192.168.56.1.5001: UDP, length 1470
00:47:31.979466 IP 192.168.56.101.47489 > 192.168.56.1.5001: UDP, length 1470
00:47:32.222327 IP 192.168.56.101.47489 > 192.168.56.1.5001: UDP, length 1470
00:47:32.342782 IP 192.168.56.101.47489 > 192.168.56.1.5001: UDP, length 1470
00:47:32.464389 IP 192.168.56.101.47489 > 192.168.56.1.5001: UDP, length 1470
00:47:32.584240 IP 192.168.56.101.47489 > 192.168.56.1.5001: UDP, length 1470
00:47:32.827620 IP 192.168.56.101.47489 > 192.168.56.1.5001: UDP, length 1470
00:47:32.947359 IP 192.168.56.101.47489 > 192.168.56.1.5001: UDP, length 1470
00:47:33.069009 IP 192.168.56.101.47489 > 192.168.56.1.5001: UDP, length 1470
00:47:33.189169 IP 192.168.56.101.47489 > 192.168.56.1.5001: UDP, length 1470
00:47:33.431097 IP 192.168.56.101.47489 > 192.168.56.1.5001: UDP, length 1470
00:47:33.552888 IP 192.168.56.101.47489 > 192.168.56.1.5001: UDP, length 1470
00:47:33.673560 IP 192.168.56.101.47489 > 192.168.56.1.5001: UDP, length 1470
00:47:33.794566 IP 192.168.56.101.47489 > 192.168.56.1.5001: UDP, length 1470
00:47:34.037190 IP 192.168.56.101.47489 > 192.168.56.1.5001: UDP, length 1470
00:47:34.156723 IP 192.168.56.101.47489 > 192.168.56.1.5001: UDP, length 1470
00:47:34.277485 IP 192.168.56.101.47489 > 192.168.56.1.5001: UDP, length 1470
00:47:34.398621 IP 192.168.56.101.47489 > 192.168.56.1.5001: UDP, length 1470
00:47:34.640406 IP 192.168.56.101.47489 > 192.168.56.1.5001: UDP, length 1470
00:47:34.762396 IP 192.168.56.101.47489 > 192.168.56.1.5001: UDP, length 1470
00:47:34.882534 IP 192.168.56.101.47489 > 192.168.56.1.5001: UDP, length 1470
00:47:35.004285 IP 192.168.56.101.47489 > 192.168.56.1.5001: UDP, length 1470
00:47:35.245407 IP 192.168.56.101.47489 > 192.168.56.1.5001: UDP, length 1470
00:47:35.366880 IP 192.168.56.101.47489 > 192.168.56.1.5001: UDP, length 1470
00:47:35.487212 IP 192.168.56.101.47489 > 192.168.56.1.5001: UDP, length 1470
00:47:35.609183 IP 192.168.56.101.47489 > 192.168.56.1.5001: UDP, length 1470
00:47:35.851077 IP 192.168.56.101.47489 > 192.168.56.1.5001: UDP, length 1470
00:47:35.971249 IP 192.168.56.101.47489 > 192.168.56.1.5001: UDP, length 1470
00:47:36.091993 IP 192.168.56.101.47489 > 192.168.56.1.5001: UDP, length 1470
00:47:36.213546 IP 192.168.56.101.47489 > 192.168.56.1.5001: UDP, length 1470
00:47:36.455375 IP 192.168.56.101.47489 > 192.168.56.1.5001: UDP, length 1470
00:47:36.575725 IP 192.168.56.101.47489 > 192.168.56.1.5001: UDP, length 1470
00:47:36.696891 IP 192.168.56.101.47489 > 192.168.56.1.5001: UDP, length 1470
00:47:36.817799 IP 192.168.56.101.47489 > 192.168.56.1.5001: UDP, length 1470
00:47:37.060592 IP 192.168.56.101.47489 > 192.168.56.1.5001: UDP, length 1470
00:47:37.181465 IP 192.168.56.101.47489 > 192.168.56.1.5001: UDP, length 1470
00:47:37.301643 IP 192.168.56.101.47489 > 192.168.56.1.5001: UDP, length 1470
00:47:37.422546 IP 192.168.56.101.47489 > 192.168.56.1.5001: UDP, length 1470
00:47:37.664452 IP 192.168.56.101.47489 > 192.168.56.1.5001: UDP, length 1470
00:47:37.785463 IP 192.168.56.101.47489 > 192.168.56.1.5001: UDP, length 1470
00:47:37.907087 IP 192.168.56.101.47489 > 192.168.56.1.5001: UDP, length 1470
00:47:38.027232 IP 192.168.56.101.47489 > 192.168.56.1.5001: UDP, length 1470
00:47:38.271119 IP 192.168.56.101.47489 > 192.168.56.1.5001: UDP, length 1470
00:47:38.390318 IP 192.168.56.101.47489 > 192.168.56.1.5001: UDP, length 1470
00:47:38.512321 IP 192.168.56.101.47489 > 192.168.56.1.5001: UDP, length 1470
00:47:38.632753 IP 192.168.56.101.47489 > 192.168.56.1.5001: UDP, length 1470
00:47:38.874014 IP 192.168.56.101.47489 > 192.168.56.1.5001: UDP, length 1470
00:47:38.995033 IP 192.168.56.101.47489 > 192.168.56.1.5001: UDP, length 1470
00:47:39.115998 IP 192.168.56.101.47489 > 192.168.56.1.5001: UDP, length 1470
00:47:39.237092 IP 192.168.56.101.47489 > 192.168.56.1.5001: UDP, length 1470
00:47:39.479563 IP 192.168.56.101.47489 > 192.168.56.1.5001: UDP, length 1470
00:47:39.600000 IP 192.168.56.101.47489 > 192.168.56.1.5001: UDP, length 1470
00:47:39.720873 IP 192.168.56.101.47489 > 192.168.56.1.5001: UDP, length 1470
00:47:39.841793 IP 192.168.56.101.47489 > 192.168.56.1.5001: UDP, length 1470
00:47:40.083632 IP 192.168.56.101.47489 > 192.168.56.1.5001: UDP, length 1470
00:47:40.205497 IP 192.168.56.101.47489 > 192.168.56.1.5001: UDP, length 1470
00:47:40.325576 IP 192.168.56.101.47489 > 192.168.56.1.5001: UDP, length 1470
00:47:40.447269 IP 192.168.56.101.47489 > 192.168.56.1.5001: UDP, length 1470
00:47:40.688558 IP 192.168.56.101.47489 > 192.168.56.1.5001: UDP, length 1470
00:47:40.810928 IP 192.168.56.101.47489 > 192.168.56.1.5001: UDP, length 1470
00:47:40.932361 IP 192.168.56.101.47489 > 192.168.56.1.5001: UDP, length 1470
00:47:41.051460 IP 192.168.56.101.47489 > 192.168.56.1.5001: UDP, length 1470
00:47:41.295208 IP 192.168.56.101.47489 > 192.168.56.1.5001: UDP, length 1470
00:47:41.414438 IP 192.168.56.101.47489 > 192.168.56.1.5001: UDP, length 1470
00:47:41.536715 IP 192.168.56.101.47489 > 192.168.56.1.5001: UDP, length 1470
00:47:41.656304 IP 192.168.56.101.47489 > 192.168.56.1.5001: UDP, length 1470
00:47:41.898464 IP 192.168.56.101.47489 > 192.168.56.1.5001: UDP, length 1470
00:47:42.018943 IP 192.168.56.101.47489 > 192.168.56.1.5001: UDP, length 1470
00:47:42.141408 IP 192.168.56.101.47489 > 192.168.56.1.5001: UDP, length 1470
00:47:42.261113 IP 192.168.56.101.47489 > 192.168.56.1.5001: UDP, length 1470
00:47:42.503918 IP 192.168.56.101.47489 > 192.168.56.1.5001: UDP, length 1470
00:47:42.623901 IP 192.168.56.101.47489 > 192.168.56.1.5001: UDP, length 1470
00:47:42.744786 IP 192.168.56.101.47489 > 192.168.56.1.5001: UDP, length 1470
00:47:42.867437 IP 192.168.56.101.47489 > 192.168.56.1.5001: UDP, length 1470
00:47:43.108371 IP 192.168.56.101.47489 > 192.168.56.1.5001: UDP, length 1470
00:47:43.228916 IP 192.168.56.101.47489 > 192.168.56.1.5001: UDP, length 1470
00:47:43.350629 IP 192.168.56.101.47489 > 192.168.56.1.5001: UDP, length 1470
00:47:43.470569 IP 192.168.56.101.47489 > 192.168.56.1.5001: UDP, length 1470
00:47:43.712812 IP 192.168.56.101.47489 > 192.168.56.1.5001: UDP, length 1470
00:47:43.833605 IP 192.168.56.101.47489 > 192.168.56.1.5001: UDP, length 1470
00:47:43.954308 IP 192.168.56.101.47489 > 192.168.56.1.5001: UDP, length 1470
00:47:44.076201 IP 192.168.56.101.47489 > 192.168.56.1.5001: UDP, length 1470
00:47:44.317841 IP 192.168.56.101.47489 > 192.168.56.1.5001: UDP, length 1470
00:47:44.438382 IP 192.168.56.101.47489 > 192.168.56.1.5001: UDP, length 1470
00:47:44.559299 IP 192.168.56.101.47489 > 192.168.56.1.5001: UDP, length 1470
00:47:44.680088 IP 192.168.56.101.47489 > 192.168.56.1.5001: UDP, length 1470
00:47:44.922377 IP 192.168.56.101.47489 > 192.168.56.1.5001: UDP, length 1470
00:47:45.044398 IP 192.168.56.101.47489 > 192.168.56.1.5001: UDP, length 1470
00:47:45.165267 IP 192.168.56.101.47489 > 192.168.56.1.5001: UDP, length 1470
00:47:45.285062 IP 192.168.56.101.47489 > 192.168.56.1.5001: UDP, length 1470
00:47:45.528468 IP 192.168.56.101.47489 > 192.168.56.1.5001: UDP, length 1470
00:47:45.647945 IP 192.168.56.101.47489 > 192.168.56.1.5001: UDP, length 1470
00:47:45.769025 IP 192.168.56.101.47489 > 192.168.56.1.5001: UDP, length 1470
00:47:45.889996 IP 192.168.56.101.47489 > 192.168.56.1.5001: UDP, length 1470
00:47:46.131608 IP 192.168.56.101.47489 > 192.168.56.1.5001: UDP, length 1470
00:47:46.253145 IP 192.168.56.101.47489 > 192.168.56.1.5001: UDP, length 1470
00:47:46.373569 IP 192.168.56.101.47489 > 192.168.56.1.5001: UDP, length 1470
00:47:46.494963 IP 192.168.56.101.47489 > 192.168.56.1.5001: UDP, length 1470
00:47:46.736480 IP 192.168.56.101.47489 > 192.168.56.1.5001: UDP, length 1470
00:47:46.857431 IP 192.168.56.101.47489 > 192.168.56.1.5001: UDP, length 1470
00:47:46.979712 IP 192.168.56.101.47489 > 192.168.56.1.5001: UDP, length 1470
00:47:47.099316 IP 192.168.56.101.47489 > 192.168.56.1.5001: UDP, length 1470
00:47:47.341176 IP 192.168.56.101.47489 > 192.168.56.1.5001: UDP, length 1470
00:47:47.463380 IP 192.168.56.101.47489 > 192.168.56.1.5001: UDP, length 1470
00:47:47.583811 IP 192.168.56.101.47489 > 192.168.56.1.5001: UDP, length 1470
00:47:47.704300 IP 192.168.56.101.47489 > 192.168.56.1.5001: UDP, length 1470
00:47:47.946940 IP 192.168.56.101.47489 > 192.168.56.1.5001: UDP, length 1470
00:47:48.067005 IP 192.168.56.101.47489 > 192.168.56.1.5001: UDP, length 1470
00:47:48.187934 IP 192.168.56.101.47489 > 192.168.56.1.5001: UDP, length 1470
00:47:48.308808 IP 192.168.56.101.47489 > 192.168.56.1.5001: UDP, length 1470
00:47:48.551668 IP 192.168.56.101.47489 > 192.168.56.1.5001: UDP, length 1470
00:47:48.671679 IP 192.168.56.101.47489 > 192.168.56.1.5001: UDP, length 1470
00:47:48.792992 IP 192.168.56.101.47489 > 192.168.56.1.5001: UDP, length 1470
00:47:48.913555 IP 192.168.56.101.47489 > 192.168.56.1.5001: UDP, length 1470
00:47:49.155744 IP 192.168.56.101.47489 > 192.168.56.1.5001: UDP, length 1470
00:47:49.276532 IP 192.168.56.101.47489 > 192.168.56.1.5001: UDP, length 1470
00:47:49.397419 IP 192.168.56.101.47489 > 192.168.56.1.5001: UDP, length 1470
00:47:49.518425 IP 192.168.56.101.47489 > 192.168.56.1.5001: UDP, length 1470
00:47:49.760325 IP 192.168.56.101.47489 > 192.168.56.1.5001: UDP, length 1470
00:47:49.881807 IP 192.168.56.101.47489 > 192.168.56.1.5001: UDP, length 1470
00:47:50.002361 IP 192.168.56.101.47489 > 192.168.56.1.5001: UDP, length 1470
00:47:50.124608 IP 192.168.56.101.47489 > 192.168.56.1.5001: UDP, length 1470
00:47:50.365464 IP 192.168.56.101.47489 > 192.168.56.1.5001: UDP, length 1470
00:47:50.486002 IP 192.168.56.101.47489 > 192.168.56.1.5001: UDP, length 1470
00:47:50.607041 IP 192.168.56.101.47489 > 192.168.56.1.5001: UDP, length 1470
00:47:50.727987 IP 192.168.56.101.47489 > 192.168.56.1.5001: UDP, length 1470
00:47:50.969970 IP 192.168.56.101.47489 > 192.168.56.1.5001: UDP, length 1470
00:47:51.090875 IP 192.168.56.101.47489 > 192.168.56.1.5001: UDP, length 1470
00:47:51.212979 IP 192.168.56.101.47489 > 192.168.56.1.5001: UDP, length 1470
00:47:51.332738 IP 192.168.56.101.47489 > 192.168.56.1.5001: UDP, length 1470
00:47:51.574653 IP 192.168.56.101.47489 > 192.168.56.1.5001: UDP, length 1470
00:47:51.695721 IP 192.168.56.101.47489 > 192.168.56.1.5001: UDP, length 1470
00:47:51.818427 IP 192.168.56.101.47489 > 192.168.56.1.5001: UDP, length 1470
00:47:51.937652 IP 192.168.56.101.47489 > 192.168.56.1.5001: UDP, length 1470
00:47:52.179470 IP 192.168.56.101.47489 > 192.168.56.1.5001: UDP, length 1470
00:47:52.301439 IP 192.168.56.101.47489 > 192.168.56.1.5001: UDP, length 1470
00:47:52.421429 IP 192.168.56.101.47489 > 192.168.56.1.5001: UDP, length 1470
00:47:52.543071 IP 192.168.56.101.47489 > 192.168.56.1.5001: UDP, length 1470
00:47:52.784576 IP 192.168.56.101.47489 > 192.168.56.1.5001: UDP, length 1470
00:47:52.905447 IP 192.168.56.101.47489 > 192.168.56.1.5001: UDP, length 1470
00:47:53.026515 IP 192.168.56.101.47489 > 192.168.56.1.5001: UDP, length 1470
00:47:53.147383 IP 192.168.56.101.47489 > 192.168.56.1.5001: UDP, length 1470
00:47:53.390763 IP 192.168.56.101.47489 > 192.168.56.1.5001: UDP, length 1470
00:47:53.511238 IP 192.168.56.101.47489 > 192.168.56.1.5001: UDP, length 1470
00:47:53.631757 IP 192.168.56.101.47489 > 192.168.56.1.5001: UDP, length 1470
00:47:53.752208 IP 192.168.56.101.47489 > 192.168.56.1.5001: UDP, length 1470
00:47:53.994207 IP 192.168.56.101.47489 > 192.168.56.1.5001: UDP, length 1470
00:47:54.116376 IP 192.168.56.101.47489 > 192.168.56.1.5001: UDP, length 1470
00:47:54.236464 IP 192.168.56.101.47489 > 192.168.56.1.5001: UDP, length 1470
00:47:54.357021 IP 192.168.56.101.47489 > 192.168.56.1.5001: UDP, length 1470
00:47:54.598929 IP 192.168.56.101.47489 > 192.168.56.1.5001: UDP, length 1470
00:47:54.720789 IP 192.168.56.101.47489 > 192.168.56.1.5001: UDP, length 1470
00:47:54.840766 IP 192.168.56.101.47489 > 192.168.56.1.5001: UDP, length 1470
00:47:54.961882 IP 192.168.56.101.47489 > 192.168.56.1.5001: UDP, length 1470
00:47:55.203812 IP 192.168.56.101.47489 > 192.168.56.1.5001: UDP, length 1470
00:47:55.326726 IP 192.168.56.101.47489 > 192.168.56.1.5001: UDP, length 1470
00:47:55.445623 IP 192.168.56.101.47489 > 192.168.56.1.5001: UDP, length 1470
00:47:55.566603 IP 192.168.56.101.47489 > 192.168.56.1.5001: UDP, length 1470
00:47:55.808717 IP 192.168.56.101.47489 > 192.168.56.1.5001: UDP, length 1470
00:47:55.929961 IP 192.168.56.101.47489 > 192.168.56.1.5001: UDP, length 1470
00:47:56.050451 IP 192.168.56.101.47489 > 192.168.56.1.5001: UDP, length 1470
00:47:56.171336 IP 192.168.56.101.47489 > 192.168.56.1.5001: UDP, length 1470
00:47:56.413319 IP 192.168.56.101.47489 > 192.168.56.1.5001: UDP, length 1470
00:47:56.535159 IP 192.168.56.101.47489 > 192.168.56.1.5001: UDP, length 1470
00:47:56.655213 IP 192.168.56.101.47489 > 192.168.56.1.5001: UDP, length 1470
00:47:56.776054 IP 192.168.56.101.47489 > 192.168.56.1.5001: UDP, length 1470
00:47:57.018170 IP 192.168.56.101.47489 > 192.168.56.1.5001: UDP, length 1470
00:47:57.139068 IP 192.168.56.101.47489 > 192.168.56.1.5001: UDP, length 1470
00:47:57.260124 IP 192.168.56.101.47489 > 192.168.56.1.5001: UDP, length 1470
00:47:57.381044 IP 192.168.56.101.47489 > 192.168.56.1.5001: UDP, length 1470
00:47:57.624407 IP 192.168.56.101.47489 > 192.168.56.1.5001: UDP, length 1470
00:47:57.744461 IP 192.168.56.101.47489 > 192.168.56.1.5001: UDP, length 1470
00:47:57.864987 IP 192.168.56.101.47489 > 192.168.56.1.5001: UDP, length 1470
00:47:57.986759 IP 192.168.56.101.47489 > 192.168.56.1.5001: UDP, length 1470
00:47:58.228787 IP 192.168.56.101.47489 > 192.168.56.1.5001: UDP, length 1470
00:47:58.348695 IP 192.168.56.101.47489 > 192.168.56.1.5001: UDP, length 1470
00:47:58.470730 IP 192.168.56.101.47489 > 192.168.56.1.5001: UDP, length 1470
00:47:58.591500 IP 192.168.56.101.47489 > 192.168.56.1.5001: UDP, length 1470
00:47:58.832375 IP 192.168.56.101.47489 > 192.168.56.1.5001: UDP, length 1470
00:47:58.954423 IP 192.168.56.101.47489 > 192.168.56.1.5001: UDP, length 1470
00:47:59.074271 IP 192.168.56.101.47489 > 192.168.56.1.5001: UDP, length 1470
00:47:59.196438 IP 192.168.56.101.47489 > 192.168.56.1.5001: UDP, length 1470
00:47:59.437381 IP 192.168.56.101.47489 > 192.168.56.1.5001: UDP, length 1470
00:47:59.558296 IP 192.168.56.101.47489 > 192.168.56.1.5001: UDP, length 1470
00:47:59.680119 IP 192.168.56.101.47489 > 192.168.56.1.5001: UDP, length 1470
00:47:59.800112 IP 192.168.56.101.47489 > 192.168.56.1.5001: UDP, length 1470
00:48:00.042217 IP 192.168.56.101.47489 > 192.168.56.1.5001: UDP, length 1470
00:48:00.163920 IP 192.168.56.101.47489 > 192.168.56.1.5001: UDP, length 1470
00:48:00.284096 IP 192.168.56.101.47489 > 192.168.56.1.5001: UDP, length 1470
00:48:00.404889 IP 192.168.56.101.47489 > 192.168.56.1.5001: UDP, length 1470
00:48:00.646752 IP 192.168.56.101.47489 > 192.168.56.1.5001: UDP, length 1470
00:48:00.767792 IP 192.168.56.101.47489 > 192.168.56.1.5001: UDP, length 1470
00:48:00.890039 IP 192.168.56.101.47489 > 192.168.56.1.5001: UDP, length 1470
00:48:01.009709 IP 192.168.56.101.47489 > 192.168.56.1.5001: UDP, length 1470
00:48:01.251867 IP 192.168.56.101.47489 > 192.168.56.1.5001: UDP, length 1470
00:48:01.374413 IP 192.168.56.101.47489 > 192.168.56.1.5001: UDP, length 1470
00:48:01.494413 IP 192.168.56.101.47489 > 192.168.56.1.5001: UDP, length 1470
00:48:01.614782 IP 192.168.56.101.47489 > 192.168.56.1.5001: UDP, length 1470
00:48:01.856417 IP 192.168.56.101.47489 > 192.168.56.1.5001: UDP, length 1470
00:48:01.977616 IP 192.168.56.101.47489 > 192.168.56.1.5001: UDP, length 1470
00:48:02.098343 IP 192.168.56.101.47489 > 192.168.56.1.5001: UDP, length 1470
00:48:02.219316 IP 192.168.56.101.47489 > 192.168.56.1.5001: UDP, length 1470
00:48:02.461404 IP 192.168.56.101.47489 > 192.168.56.1.5001: UDP, length 1470
00:48:02.583175 IP 192.168.56.101.47489 > 192.168.56.1.5001: UDP, length 1470
00:48:02.703135 IP 192.168.56.101.47489 > 192.168.56.1.5001: UDP, length 1470
00:48:02.824299 IP 192.168.56.101.47489 > 192.168.56.1.5001: UDP, length 1470
00:48:03.066102 IP 192.168.56.101.47489 > 192.168.56.1.5001: UDP, length 1470
00:48:03.187092 IP 192.168.56.101.47489 > 192.168.56.1.5001: UDP, length 1470
00:48:03.307718 IP 192.168.56.101.47489 > 192.168.56.1.5001: UDP, length 1470
00:48:03.429697 IP 192.168.56.101.47489 > 192.168.56.1.5001: UDP, length 1470
00:48:03.672107 IP 192.168.56.101.47489 > 192.168.56.1.5001: UDP, length 1470
00:48:03.792882 IP 192.168.56.101.47489 > 192.168.56.1.5001: UDP, length 1470
00:48:03.912684 IP 192.168.56.101.47489 > 192.168.56.1.5001: UDP, length 1470
00:48:04.035221 IP 192.168.56.101.47489 > 192.168.56.1.5001: UDP, length 1470
00:48:04.275744 IP 192.168.56.101.47489 > 192.168.56.1.5001: UDP, length 1470
00:48:04.396715 IP 192.168.56.101.47489 > 192.168.56.1.5001: UDP, length 1470
00:48:04.517446 IP 192.168.56.101.47489 > 192.168.56.1.5001: UDP, length 1470
00:48:04.639258 IP 192.168.56.101.47489 > 192.168.56.1.5001: UDP, length 1470
00:48:04.880358 IP 192.168.56.101.47489 > 192.168.56.1.5001: UDP, length 1470
00:48:05.002457 IP 192.168.56.101.47489 > 192.168.56.1.5001: UDP, length 1470
00:48:05.122466 IP 192.168.56.101.47489 > 192.168.56.1.5001: UDP, length 1470
00:48:05.243292 IP 192.168.56.101.47489 > 192.168.56.1.5001: UDP, length 1470
00:48:05.485689 IP 192.168.56.101.47489 > 192.168.56.1.5001: UDP, length 1470
00:48:05.607652 IP 192.168.56.101.47489 > 192.168.56.1.5001: UDP, length 1470
00:48:05.727320 IP 192.168.56.101.47489 > 192.168.56.1.5001: UDP, length 1470
00:48:05.848358 IP 192.168.56.101.47489 > 192.168.56.1.5001: UDP, length 1470
00:48:06.090096 IP 192.168.56.101.47489 > 192.168.56.1.5001: UDP, length 1470
00:48:06.212055 IP 192.168.56.101.47489 > 192.168.56.1.5001: UDP, length 1470
00:48:06.332931 IP 192.168.56.101.47489 > 192.168.56.1.5001: UDP, length 1470
00:48:06.453273 IP 192.168.56.101.47489 > 192.168.56.1.5001: UDP, length 1470
00:48:06.694768 IP 192.168.56.101.47489 > 192.168.56.1.5001: UDP, length 1470
00:48:06.816039 IP 192.168.56.101.47489 > 192.168.56.1.5001: UDP, length 1470
00:48:06.936572 IP 192.168.56.101.47489 > 192.168.56.1.5001: UDP, length 1470
00:48:07.058301 IP 192.168.56.101.47489 > 192.168.56.1.5001: UDP, length 1470
00:48:07.299546 IP 192.168.56.101.47489 > 192.168.56.1.5001: UDP, length 1470
00:48:07.420660 IP 192.168.56.101.47489 > 192.168.56.1.5001: UDP, length 1470
00:48:07.541569 IP 192.168.56.101.47489 > 192.168.56.1.5001: UDP, length 1470
00:48:07.662612 IP 192.168.56.101.47489 > 192.168.56.1.5001: UDP, length 1470
00:48:07.905208 IP 192.168.56.101.47489 > 192.168.56.1.5001: UDP, length 1470
00:48:08.025355 IP 192.168.56.101.47489 > 192.168.56.1.5001: UDP, length 1470
00:48:08.146458 IP 192.168.56.101.47489 > 192.168.56.1.5001: UDP, length 1470
00:48:08.267444 IP 192.168.56.101.47489 > 192.168.56.1.5001: UDP, length 1470
00:48:08.509485 IP 192.168.56.101.47489 > 192.168.56.1.5001: UDP, length 1470
00:48:08.630495 IP 192.168.56.101.47489 > 192.168.56.1.5001: UDP, length 1470
00:48:08.751589 IP 192.168.56.101.47489 > 192.168.56.1.5001: UDP, length 1470
00:48:08.872297 IP 192.168.56.101.47489 > 192.168.56.1.5001: UDP, length 1470
00:48:09.114895 IP 192.168.56.101.47489 > 192.168.56.1.5001: UDP, length 1470
00:48:09.235921 IP 192.168.56.101.47489 > 192.168.56.1.5001: UDP, length 1470
00:48:09.357646 IP 192.168.56.101.47489 > 192.168.56.1.5001: UDP, length 1470
00:48:09.476998 IP 192.168.56.101.47489 > 192.168.56.1.5001: UDP, length 1470
00:48:09.719156 IP 192.168.56.101.47489 > 192.168.56.1.5001: UDP, length 1470
00:48:09.839909 IP 192.168.56.101.47489 > 192.168.56.1.5001: UDP, length 1470
00:48:09.961421 IP 192.168.56.101.47489 > 192.168.56.1.5001: UDP, length 1470
00:48:10.082076 IP 192.168.56.101.47489 > 192.168.56.1.5001: UDP, length 1470
00:48:10.323528 IP 192.168.56.101.47489 > 192.168.56.1.5001: UDP, length 1470
00:48:10.444663 IP 192.168.56.101.47489 > 192.168.56.1.5001: UDP, length 1470
00:48:10.567102 IP 192.168.56.101.47489 > 192.168.56.1.5001: UDP, length 1470
00:48:10.686680 IP 192.168.56.101.47489 > 192.168.56.1.5001: UDP, length 1470
00:48:10.929623 IP 192.168.56.101.47489 > 192.168.56.1.5001: UDP, length 1470
00:48:11.049565 IP 192.168.56.101.47489 > 192.168.56.1.5001: UDP, length 1470
00:48:11.170343 IP 192.168.56.101.47489 > 192.168.56.1.5001: UDP, length 1470
00:48:11.291510 IP 192.168.56.101.47489 > 192.168.56.1.5001: UDP, length 1470
00:48:11.534665 IP 192.168.56.101.47489 > 192.168.56.1.5001: UDP, length 1470
00:48:11.654285 IP 192.168.56.101.47489 > 192.168.56.1.5001: UDP, length 1470
00:48:11.775350 IP 192.168.56.101.47489 > 192.168.56.1.5001: UDP, length 1470
00:48:11.896314 IP 192.168.56.101.47489 > 192.168.56.1.5001: UDP, length 1470
00:48:12.139089 IP 192.168.56.101.47489 > 192.168.56.1.5001: UDP, length 1470
00:48:12.258860 IP 192.168.56.101.47489 > 192.168.56.1.5001: UDP, length 1470
00:48:12.381878 IP 192.168.56.101.47489 > 192.168.56.1.5001: UDP, length 1470
00:48:12.501245 IP 192.168.56.101.47489 > 192.168.56.1.5001: UDP, length 1470
00:48:12.742768 IP 192.168.56.101.47489 > 192.168.56.1.5001: UDP, length 1470
00:48:12.865909 IP 192.168.56.101.47489 > 192.168.56.1.5001: UDP, length 1470
00:48:12.984811 IP 192.168.56.101.47489 > 192.168.56.1.5001: UDP, length 1470
00:48:13.105753 IP 192.168.56.101.47489 > 192.168.56.1.5001: UDP, length 1470
00:48:13.348049 IP 192.168.56.101.47489 > 192.168.56.1.5001: UDP, length 1470
00:48:13.472712 IP 192.168.56.101.47489 > 192.168.56.1.5001: UDP, length 1470
00:48:13.589481 IP 192.168.56.101.47489 > 192.168.56.1.5001: UDP, length 1470
00:48:13.710435 IP 192.168.56.101.47489 > 192.168.56.1.5001: UDP, length 1470
00:48:13.953383 IP 192.168.56.101.47489 > 192.168.56.1.5001: UDP, length 1470
00:48:14.073463 IP 192.168.56.101.47489 > 192.168.56.1.5001: UDP, length 1470
00:48:14.195682 IP 192.168.56.101.47489 > 192.168.56.1.5001: UDP, length 1470
00:48:14.316056 IP 192.168.56.101.47489 > 192.168.56.1.5001: UDP, length 1470
00:48:14.557240 IP 192.168.56.101.47489 > 192.168.56.1.5001: UDP, length 1470
00:48:14.678267 IP 192.168.56.101.47489 > 192.168.56.1.5001: UDP, length 1470
00:48:14.799109 IP 192.168.56.101.47489 > 192.168.56.1.5001: UDP, length 1470
00:48:14.920350 IP 192.168.56.101.47489 > 192.168.56.1.5001: UDP, length 1470
00:48:15.163998 IP 192.168.56.101.47489 > 192.168.56.1.5001: UDP, length 1470
00:48:15.283018 IP 192.168.56.101.47489 > 192.168.56.1.5001: UDP, length 1470
00:48:15.404795 IP 192.168.56.101.47489 > 192.168.56.1.5001: UDP, length 1470
00:48:15.525340 IP 192.168.56.101.47489 > 192.168.56.1.5001: UDP, length 1470
00:48:15.766904 IP 192.168.56.101.47489 > 192.168.56.1.5001: UDP, length 1470
00:48:15.887834 IP 192.168.56.101.47489 > 192.168.56.1.5001: UDP, length 1470
00:48:16.010746 IP 192.168.56.101.47489 > 192.168.56.1.5001: UDP, length 1470
00:48:16.130814 IP 192.168.56.101.47489 > 192.168.56.1.5001: UDP, length 1470
00:48:16.371727 IP 192.168.56.101.47489 > 192.168.56.1.5001: UDP, length 1470
00:48:16.493902 IP 192.168.56.101.47489 > 192.168.56.1.5001: UDP, length 1470
00:48:16.614529 IP 192.168.56.101.47489 > 192.168.56.1.5001: UDP, length 1470
00:48:16.735573 IP 192.168.56.101.47489 > 192.168.56.1.5001: UDP, length 1470
00:48:16.977617 IP 192.168.56.101.47489 > 192.168.56.1.5001: UDP, length 1470
00:48:17.099229 IP 192.168.56.101.47489 > 192.168.56.1.5001: UDP, length 1470
00:48:17.218356 IP 192.168.56.101.47489 > 192.168.56.1.5001: UDP, length 1470
00:48:17.339727 IP 192.168.56.101.47489 > 192.168.56.1.5001: UDP, length 1470
00:48:17.581216 IP 192.168.56.101.47489 > 192.168.56.1.5001: UDP, length 1470
00:48:17.703540 IP 192.168.56.101.47489 > 192.168.56.1.5001: UDP, length 1470
00:48:17.823606 IP 192.168.56.101.47489 > 192.168.56.1.5001: UDP, length 1470
00:48:17.944317 IP 192.168.56.101.47489 > 192.168.56.1.5001: UDP, length 1470
00:48:18.065208 IP 192.168.56.101.47489 > 192.168.56.1.5001: UDP, length 1470
00:48:18.186244 IP 192.168.56.101.47489 > 192.168.56.1.5001: UDP, length 1470
00:48:18.307132 IP 192.168.56.101.47489 > 192.168.56.1.5001: UDP, length 1470
00:48:18.427804 IP 192.168.56.101.47489 > 192.168.56.1.5001: UDP, length 1470
00:48:18.548887 IP 192.168.56.101.47489 > 192.168.56.1.5001: UDP, length 1470
00:48:18.670301 IP 192.168.56.101.47489 > 192.168.56.1.5001: UDP, length 1470
00:48:18.790968 IP 192.168.56.101.47489 > 192.168.56.1.5001: UDP, length 1470
00:48:18.911922 IP 192.168.56.101.47489 > 192.168.56.1.5001: UDP, length 1470
00:48:19.032639 IP 192.168.56.101.47489 > 192.168.56.1.5001: UDP, length 1470
00:48:19.154659 IP 192.168.56.101.47489 > 192.168.56.1.5001: UDP, length 1470
00:48:19.274853 IP 192.168.56.101.47489 > 192.168.56.1.5001: UDP, length 1470
00:48:19.395769 IP 192.168.56.101.47489 > 192.168.56.1.5001: UDP, length 1470
00:48:19.517267 IP 192.168.56.101.47489 > 192.168.56.1.5001: UDP, length 1470
00:48:19.637466 IP 192.168.56.101.47489 > 192.168.56.1.5001: UDP, length 1470
00:48:19.758777 IP 192.168.56.101.47489 > 192.168.56.1.5001: UDP, length 1470
00:48:19.879578 IP 192.168.56.101.47489 > 192.168.56.1.5001: UDP, length 1470
00:48:20.000479 IP 192.168.56.101.47489 > 192.168.56.1.5001: UDP, length 1470
00:48:20.121577 IP 192.168.56.101.47489 > 192.168.56.1.5001: UDP, length 1470
00:48:20.242544 IP 192.168.56.101.47489 > 192.168.56.1.5001: UDP, length 1470
00:48:20.363772 IP 192.168.56.101.47489 > 192.168.56.1.5001: UDP, length 1470
00:48:20.484528 IP 192.168.56.101.47489 > 192.168.56.1.5001: UDP, length 1470
00:48:20.605488 IP 192.168.56.101.47489 > 192.168.56.1.5001: UDP, length 1470
00:48:20.726316 IP 192.168.56.101.47489 > 192.168.56.1.5001: UDP, length 1470
00:48:20.846996 IP 192.168.56.101.47489 > 192.168.56.1.5001: UDP, length 1470
00:48:20.968126 IP 192.168.56.101.47489 > 192.168.56.1.5001: UDP, length 1470
00:48:21.089331 IP 192.168.56.101.47489 > 192.168.56.1.5001: UDP, length 1470
00:48:21.210209 IP 192.168.56.101.47489 > 192.168.56.1.5001: UDP, length 1470
00:48:21.331252 IP 192.168.56.101.47489 > 192.168.56.1.5001: UDP, length 1470
00:48:21.452397 IP 192.168.56.101.47489 > 192.168.56.1.5001: UDP, length 1470
00:48:21.573967 IP 192.168.56.101.47489 > 192.168.56.1.5001: UDP, length 1470
00:48:21.694153 IP 192.168.56.101.47489 > 192.168.56.1.5001: UDP, length 1470
00:48:21.814871 IP 192.168.56.101.47489 > 192.168.56.1.5001: UDP, length 1470
00:48:21.935995 IP 192.168.56.101.47489 > 192.168.56.1.5001: UDP, length 1470
00:48:22.057089 IP 192.168.56.101.47489 > 192.168.56.1.5001: UDP, length 1470
00:48:22.178427 IP 192.168.56.101.47489 > 192.168.56.1.5001: UDP, length 1470
00:48:22.300095 IP 192.168.56.101.47489 > 192.168.56.1.5001: UDP, length 1470
00:48:22.419704 IP 192.168.56.101.47489 > 192.168.56.1.5001: UDP, length 1470
00:48:22.540790 IP 192.168.56.101.47489 > 192.168.56.1.5001: UDP, length 1470
00:48:22.661546 IP 192.168.56.101.47489 > 192.168.56.1.5001: UDP, length 1470
00:48:22.782530 IP 192.168.56.101.47489 > 192.168.56.1.5001: UDP, length 1470
00:48:22.904649 IP 192.168.56.101.47489 > 192.168.56.1.5001: UDP, length 1470
00:48:23.025547 IP 192.168.56.101.47489 > 192.168.56.1.5001: UDP, length 1470
00:48:23.145581 IP 192.168.56.101.47489 > 192.168.56.1.5001: UDP, length 1470
00:48:23.267516 IP 192.168.56.101.47489 > 192.168.56.1.5001: UDP, length 1470
00:48:23.387437 IP 192.168.56.101.47489 > 192.168.56.1.5001: UDP, length 1470
00:48:23.508372 IP 192.168.56.101.47489 > 192.168.56.1.5001: UDP, length 1470
00:48:23.630205 IP 192.168.56.101.47489 > 192.168.56.1.5001: UDP, length 1470
00:48:23.750268 IP 192.168.56.101.47489 > 192.168.56.1.5001: UDP, length 1470
00:48:23.871375 IP 192.168.56.101.47489 > 192.168.56.1.5001: UDP, length 1470
00:48:23.992313 IP 192.168.56.101.47489 > 192.168.56.1.5001: UDP, length 1470
00:48:24.113658 IP 192.168.56.101.47489 > 192.168.56.1.5001: UDP, length 1470
00:48:24.234858 IP 192.168.56.101.47489 > 192.168.56.1.5001: UDP, length 1470
00:48:24.355103 IP 192.168.56.101.47489 > 192.168.56.1.5001: UDP, length 1470
00:48:24.476002 IP 192.168.56.101.47489 > 192.168.56.1.5001: UDP, length 1470
00:48:24.596905 IP 192.168.56.101.47489 > 192.168.56.1.5001: UDP, length 1470
00:48:24.717822 IP 192.168.56.101.47489 > 192.168.56.1.5001: UDP, length 1470
00:48:24.839775 IP 192.168.56.101.47489 > 192.168.56.1.5001: UDP, length 1470
00:48:24.960507 IP 192.168.56.101.47489 > 192.168.56.1.5001: UDP, length 1470
00:48:25.081139 IP 192.168.56.101.47489 > 192.168.56.1.5001: UDP, length 1470
00:48:25.202754 IP 192.168.56.101.47489 > 192.168.56.1.5001: UDP, length 1470
00:48:25.322719 IP 192.168.56.101.47489 > 192.168.56.1.5001: UDP, length 1470
00:48:25.444252 IP 192.168.56.101.47489 > 192.168.56.1.5001: UDP, length 1470
00:48:25.565216 IP 192.168.56.101.47489 > 192.168.56.1.5001: UDP, length 1470
00:48:25.686317 IP 192.168.56.101.47489 > 192.168.56.1.5001: UDP, length 1470
00:48:25.806559 IP 192.168.56.101.47489 > 192.168.56.1.5001: UDP, length 1470
00:48:25.928117 IP 192.168.56.101.47489 > 192.168.56.1.5001: UDP, length 1470
00:48:26.049527 IP 192.168.56.101.47489 > 192.168.56.1.5001: UDP, length 1470
00:48:26.169570 IP 192.168.56.101.47489 > 192.168.56.1.5001: UDP, length 1470
00:48:26.290462 IP 192.168.56.101.47489 > 192.168.56.1.5001: UDP, length 1470
00:48:26.411356 IP 192.168.56.101.47489 > 192.168.56.1.5001: UDP, length 1470
00:48:26.532410 IP 192.168.56.101.47489 > 192.168.56.1.5001: UDP, length 1470
00:48:26.653171 IP 192.168.56.101.47489 > 192.168.56.1.5001: UDP, length 1470
00:48:26.775005 IP 192.168.56.101.47489 > 192.168.56.1.5001: UDP, length 1470
00:48:26.895374 IP 192.168.56.101.47489 > 192.168.56.1.5001: UDP, length 1470
00:48:27.016157 IP 192.168.56.101.47489 > 192.168.56.1.5001: UDP, length 1470
00:48:27.137044 IP 192.168.56.101.47489 > 192.168.56.1.5001: UDP, length 1470
00:48:27.258163 IP 192.168.56.101.47489 > 192.168.56.1.5001: UDP, length 1470
00:48:27.379102 IP 192.168.56.101.47489 > 192.168.56.1.5001: UDP, length 1470
00:48:27.501470 IP 192.168.56.101.47489 > 192.168.56.1.5001: UDP, length 1470
00:48:27.621079 IP 192.168.56.101.47489 > 192.168.56.1.5001: UDP, length 1470
00:48:27.741921 IP 192.168.56.101.47489 > 192.168.56.1.5001: UDP, length 1470
00:48:27.863687 IP 192.168.56.101.47489 > 192.168.56.1.5001: UDP, length 1470
00:48:27.984150 IP 192.168.56.101.47489 > 192.168.56.1.5001: UDP, length 1470
00:48:28.105699 IP 192.168.56.101.47489 > 192.168.56.1.5001: UDP, length 1470
00:48:28.225780 IP 192.168.56.101.47489 > 192.168.56.1.5001: UDP, length 1470
00:48:28.346763 IP 192.168.56.101.47489 > 192.168.56.1.5001: UDP, length 1470
00:48:28.467777 IP 192.168.56.101.47489 > 192.168.56.1.5001: UDP, length 1470
00:48:28.588757 IP 192.168.56.101.47489 > 192.168.56.1.5001: UDP, length 1470
00:48:28.710033 IP 192.168.56.101.47489 > 192.168.56.1.5001: UDP, length 1470
00:48:28.830419 IP 192.168.56.101.47489 > 192.168.56.1.5001: UDP, length 1470
00:48:28.951544 IP 192.168.56.101.47489 > 192.168.56.1.5001: UDP, length 1470
00:48:29.072609 IP 192.168.56.101.47489 > 192.168.56.1.5001: UDP, length 1470
00:48:29.193513 IP 192.168.56.101.47489 > 192.168.56.1.5001: UDP, length 1470
00:48:29.314607 IP 192.168.56.101.47489 > 192.168.56.1.5001: UDP, length 1470
00:48:29.436372 IP 192.168.56.101.47489 > 192.168.56.1.5001: UDP, length 1470
00:48:29.556352 IP 192.168.56.101.47489 > 192.168.56.1.5001: UDP, length 1470
00:48:29.677307 IP 192.168.56.101.47489 > 192.168.56.1.5001: UDP, length 1470
00:48:29.798246 IP 192.168.56.101.47489 > 192.168.56.1.5001: UDP, length 1470
00:48:29.920653 IP 192.168.56.101.47489 > 192.168.56.1.5001: UDP, length 1470
00:48:30.040026 IP 192.168.56.101.47489 > 192.168.56.1.5001: UDP, length 1470
00:48:30.160976 IP 192.168.56.101.47489 > 192.168.56.1.5001: UDP, length 1470
00:48:30.283327 IP 192.168.56.101.47489 > 192.168.56.1.5001: UDP, length 1470
00:48:30.404047 IP 192.168.56.101.47489 > 192.168.56.1.5001: UDP, length 1470
00:48:30.524053 IP 192.168.56.101.47489 > 192.168.56.1.5001: UDP, length 1470
00:48:30.645078 IP 192.168.56.101.47489 > 192.168.56.1.5001: UDP, length 1470
00:48:30.765758 IP 192.168.56.101.47489 > 192.168.56.1.5001: UDP, length 1470
00:48:30.886746 IP 192.168.56.101.47489 > 192.168.56.1.5001: UDP, length 1470
00:48:31.008177 IP 192.168.56.101.47489 > 192.168.56.1.5001: UDP, length 1470
00:48:31.129234 IP 192.168.56.101.47489 > 192.168.56.1.5001: UDP, length 1470
00:48:31.249775 IP 192.168.56.101.47489 > 192.168.56.1.5001: UDP, length 1470
00:48:31.370874 IP 192.168.56.101.47489 > 192.168.56.1.5001: UDP, length 1470
00:48:31.491746 IP 192.168.56.101.47489 > 192.168.56.1.5001: UDP, length 1470
00:48:31.612708 IP 192.168.56.101.47489 > 192.168.56.1.5001: UDP, length 1470
00:48:31.733553 IP 192.168.56.101.47489 > 192.168.56.1.5001: UDP, length 1470
00:48:31.854459 IP 192.168.56.101.47489 > 192.168.56.1.5001: UDP, length 1470
00:48:31.975382 IP 192.168.56.101.47489 > 192.168.56.1.5001: UDP, length 1470
00:48:32.096343 IP 192.168.56.101.47489 > 192.168.56.1.5001: UDP, length 1470
00:48:32.217265 IP 192.168.56.101.47489 > 192.168.56.1.5001: UDP, length 1470
00:48:32.339413 IP 192.168.56.101.47489 > 192.168.56.1.5001: UDP, length 1470
00:48:32.459956 IP 192.168.56.101.47489 > 192.168.56.1.5001: UDP, length 1470
00:48:32.581058 IP 192.168.56.101.47489 > 192.168.56.1.5001: UDP, length 1470
00:48:32.701315 IP 192.168.56.101.47489 > 192.168.56.1.5001: UDP, length 1470
00:48:32.822284 IP 192.168.56.101.47489 > 192.168.56.1.5001: UDP, length 1470
00:48:32.944670 IP 192.168.56.101.47489 > 192.168.56.1.5001: UDP, length 1470
00:48:33.064325 IP 192.168.56.101.47489 > 192.168.56.1.5001: UDP, length 1470
00:48:33.186901 IP 192.168.56.101.47489 > 192.168.56.1.5001: UDP, length 1470
00:48:33.307153 IP 192.168.56.101.47489 > 192.168.56.1.5001: UDP, length 1470
00:48:33.427179 IP 192.168.56.101.47489 > 192.168.56.1.5001: UDP, length 1470
00:48:33.548161 IP 192.168.56.101.47489 > 192.168.56.1.5001: UDP, length 1470
00:48:33.669705 IP 192.168.56.101.47489 > 192.168.56.1.5001: UDP, length 1470
00:48:33.791122 IP 192.168.56.101.47489 > 192.168.56.1.5001: UDP, length 1470
00:48:33.911918 IP 192.168.56.101.47489 > 192.168.56.1.5001: UDP, length 1470
00:48:34.032057 IP 192.168.56.101.47489 > 192.168.56.1.5001: UDP, length 1470
00:48:34.152635 IP 192.168.56.101.47489 > 192.168.56.1.5001: UDP, length 1470
00:48:34.274698 IP 192.168.56.101.47489 > 192.168.56.1.5001: UDP, length 1470
00:48:34.395695 IP 192.168.56.101.47489 > 192.168.56.1.5001: UDP, length 1470
00:48:34.516074 IP 192.168.56.101.47489 > 192.168.56.1.5001: UDP, length 1470
00:48:34.636635 IP 192.168.56.101.47489 > 192.168.56.1.5001: UDP, length 1470
00:48:34.758824 IP 192.168.56.101.47489 > 192.168.56.1.5001: UDP, length 1470
00:48:34.878713 IP 192.168.56.101.47489 > 192.168.56.1.5001: UDP, length 1470
00:48:34.999585 IP 192.168.56.101.47489 > 192.168.56.1.5001: UDP, length 1470
00:48:35.120489 IP 192.168.56.101.47489 > 192.168.56.1.5001: UDP, length 1470
00:48:35.241343 IP 192.168.56.101.47489 > 192.168.56.1.5001: UDP, length 1470
00:48:35.363226 IP 192.168.56.101.47489 > 192.168.56.1.5001: UDP, length 1470
00:48:35.483963 IP 192.168.56.101.47489 > 192.168.56.1.5001: UDP, length 1470
00:48:35.604440 IP 192.168.56.101.47489 > 192.168.56.1.5001: UDP, length 1470
00:48:35.725442 IP 192.168.56.101.47489 > 192.168.56.1.5001: UDP, length 1470
00:48:35.846401 IP 192.168.56.101.47489 > 192.168.56.1.5001: UDP, length 1470
00:48:35.967313 IP 192.168.56.101.47489 > 192.168.56.1.5001: UDP, length 1470
00:48:36.089817 IP 192.168.56.101.47489 > 192.168.56.1.5001: UDP, length 1470
00:48:36.209126 IP 192.168.56.101.47489 > 192.168.56.1.5001: UDP, length 1470
00:48:36.330159 IP 192.168.56.101.47489 > 192.168.56.1.5001: UDP, length 1470
00:48:36.451961 IP 192.168.56.101.47489 > 192.168.56.1.5001: UDP, length 1470
00:48:36.572154 IP 192.168.56.101.47489 > 192.168.56.1.5001: UDP, length 1470
00:48:36.693169 IP 192.168.56.101.47489 > 192.168.56.1.5001: UDP, length 1470
00:48:36.815358 IP 192.168.56.101.47489 > 192.168.56.1.5001: UDP, length 1470
00:48:36.934978 IP 192.168.56.101.47489 > 192.168.56.1.5001: UDP, length 1470
00:48:37.056939 IP 192.168.56.101.47489 > 192.168.56.1.5001: UDP, length 1470
00:48:37.177885 IP 192.168.56.101.47489 > 192.168.56.1.5001: UDP, length 1470
00:48:37.298805 IP 192.168.56.101.47489 > 192.168.56.1.5001: UDP, length 1470
00:48:37.419958 IP 192.168.56.101.47489 > 192.168.56.1.5001: UDP, length 1470
00:48:37.539725 IP 192.168.56.101.47489 > 192.168.56.1.5001: UDP, length 1470
00:48:37.661669 IP 192.168.56.101.47489 > 192.168.56.1.5001: UDP, length 1470
00:48:37.781532 IP 192.168.56.101.47489 > 192.168.56.1.5001: UDP, length 1470
00:48:37.902443 IP 192.168.56.101.47489 > 192.168.56.1.5001: UDP, length 1470
00:48:38.024707 IP 192.168.56.101.47489 > 192.168.56.1.5001: UDP, length 1470
00:48:38.144657 IP 192.168.56.101.47489 > 192.168.56.1.5001: UDP, length 1470
00:48:38.265239 IP 192.168.56.101.47489 > 192.168.56.1.5001: UDP, length 1470
00:48:38.386308 IP 192.168.56.101.47489 > 192.168.56.1.5001: UDP, length 1470
00:48:38.507416 IP 192.168.56.101.47489 > 192.168.56.1.5001: UDP, length 1470
00:48:38.629882 IP 192.168.56.101.47489 > 192.168.56.1.5001: UDP, length 1470
00:48:38.749417 IP 192.168.56.101.47489 > 192.168.56.1.5001: UDP, length 1470
00:48:38.871209 IP 192.168.56.101.47489 > 192.168.56.1.5001: UDP, length 1470
00:48:38.992423 IP 192.168.56.101.47489 > 192.168.56.1.5001: UDP, length 1470
00:48:39.113133 IP 192.168.56.101.47489 > 192.168.56.1.5001: UDP, length 1470
00:48:39.233196 IP 192.168.56.101.47489 > 192.168.56.1.5001: UDP, length 1470
00:48:39.354095 IP 192.168.56.101.47489 > 192.168.56.1.5001: UDP, length 1470
00:48:39.475008 IP 192.168.56.101.47489 > 192.168.56.1.5001: UDP, length 1470
00:48:39.596100 IP 192.168.56.101.47489 > 192.168.56.1.5001: UDP, length 1470
00:48:39.716869 IP 192.168.56.101.47489 > 192.168.56.1.5001: UDP, length 1470
00:48:39.838059 IP 192.168.56.101.47489 > 192.168.56.1.5001: UDP, length 1470
00:48:39.958909 IP 192.168.56.101.47489 > 192.168.56.1.5001: UDP, length 1470
00:48:40.081106 IP 192.168.56.101.47489 > 192.168.56.1.5001: UDP, length 1470
00:48:40.201671 IP 192.168.56.101.47489 > 192.168.56.1.5001: UDP, length 1470
00:48:40.321601 IP 192.168.56.101.47489 > 192.168.56.1.5001: UDP, length 1470
00:48:40.442507 IP 192.168.56.101.47489 > 192.168.56.1.5001: UDP, length 1470
00:48:40.564172 IP 192.168.56.101.47489 > 192.168.56.1.5001: UDP, length 1470
00:48:40.684727 IP 192.168.56.101.47489 > 192.168.56.1.5001: UDP, length 1470
00:48:40.806761 IP 192.168.56.101.47489 > 192.168.56.1.5001: UDP, length 1470
00:48:40.926540 IP 192.168.56.101.47489 > 192.168.56.1.5001: UDP, length 1470
00:48:41.047590 IP 192.168.56.101.47489 > 192.168.56.1.5001: UDP, length 1470
00:48:41.168602 IP 192.168.56.101.47489 > 192.168.56.1.5001: UDP, length 1470
00:48:41.289552 IP 192.168.56.101.47489 > 192.168.56.1.5001: UDP, length 1470
00:48:41.410458 IP 192.168.56.101.47489 > 192.168.56.1.5001: UDP, length 1470
00:48:41.532152 IP 192.168.56.101.47489 > 192.168.56.1.5001: UDP, length 1470
00:48:41.652363 IP 192.168.56.101.47489 > 192.168.56.1.5001: UDP, length 1470
00:48:41.773343 IP 192.168.56.101.47489 > 192.168.56.1.5001: UDP, length 1470
00:48:41.894187 IP 192.168.56.101.47489 > 192.168.56.1.5001: UDP, length 1470
00:48:42.015517 IP 192.168.56.101.47489 > 192.168.56.1.5001: UDP, length 1470
00:48:42.137890 IP 192.168.56.101.47489 > 192.168.56.1.5001: UDP, length 1470
00:48:42.258722 IP 192.168.56.101.47489 > 192.168.56.1.5001: UDP, length 1470
00:48:42.378447 IP 192.168.56.101.47489 > 192.168.56.1.5001: UDP, length 1470
00:48:42.500621 IP 192.168.56.101.47489 > 192.168.56.1.5001: UDP, length 1470

