14:09:13.256913 IP 10.0.2.15.53640 > 192.168.56.1.5001: UDP, length 1470
14:09:13.378267 IP 10.0.2.15.53640 > 192.168.56.1.5001: UDP, length 1470
14:09:13.499064 IP 10.0.2.15.53640 > 192.168.56.1.5001: UDP, length 1470
14:09:13.620966 IP 10.0.2.15.53640 > 192.168.56.1.5001: UDP, length 1470
14:09:13.741087 IP 10.0.2.15.53640 > 192.168.56.1.5001: UDP, length 1470
14:09:13.863065 IP 10.0.2.15.53640 > 192.168.56.1.5001: UDP, length 1470
14:09:13.983017 IP 10.0.2.15.53640 > 192.168.56.1.5001: UDP, length 1470
14:09:14.104803 IP 10.0.2.15.53640 > 192.168.56.1.5001: UDP, length 1470
14:09:14.225222 IP 10.0.2.15.53640 > 192.168.56.1.5001: UDP, length 1470
14:09:14.347204 IP 10.0.2.15.53640 > 192.168.56.1.5001: UDP, length 1470
14:09:14.466897 IP 10.0.2.15.53640 > 192.168.56.1.5001: UDP, length 1470
14:09:14.587804 IP 10.0.2.15.53640 > 192.168.56.1.5001: UDP, length 1470
14:09:14.708687 IP 10.0.2.15.53640 > 192.168.56.1.5001: UDP, length 1470
14:09:14.830111 IP 10.0.2.15.53640 > 192.168.56.1.5001: UDP, length 1470
14:09:14.951959 IP 10.0.2.15.53640 > 192.168.56.1.5001: UDP, length 1470
14:09:15.072616 IP 10.0.2.15.53640 > 192.168.56.1.5001: UDP, length 1470
14:09:15.192647 IP 10.0.2.15.53640 > 192.168.56.1.5001: UDP, length 1470
14:09:15.313613 IP 10.0.2.15.53640 > 192.168.56.1.5001: UDP, length 1470
14:09:15.435430 IP 10.0.2.15.53640 > 192.168.56.1.5001: UDP, length 1470
14:09:15.555569 IP 10.0.2.15.53640 > 192.168.56.1.5001: UDP, length 1470
14:09:15.676410 IP 10.0.2.15.53640 > 192.168.56.1.5001: UDP, length 1470
14:09:15.797465 IP 10.0.2.15.53640 > 192.168.56.1.5001: UDP, length 1470
14:09:15.918303 IP 10.0.2.15.53640 > 192.168.56.1.5001: UDP, length 1470
14:09:16.040183 IP 10.0.2.15.53640 > 192.168.56.1.5001: UDP, length 1470
14:09:16.161937 IP 10.0.2.15.53640 > 192.168.56.1.5001: UDP, length 1470
14:09:16.281859 IP 10.0.2.15.53640 > 192.168.56.1.5001: UDP, length 1470
14:09:16.402184 IP 10.0.2.15.53640 > 192.168.56.1.5001: UDP, length 1470
14:09:16.523185 IP 10.0.2.15.53640 > 192.168.56.1.5001: UDP, length 1470
14:09:16.644136 IP 10.0.2.15.53640 > 192.168.56.1.5001: UDP, length 1470
14:09:16.765033 IP 10.0.2.15.53640 > 192.168.56.1.5001: UDP, length 1470
14:09:16.887046 IP 10.0.2.15.53640 > 192.168.56.1.5001: UDP, length 1470
14:09:17.007992 IP 10.0.2.15.53640 > 192.168.56.1.5001: UDP, length 1470
14:09:17.127896 IP 10.0.2.15.53640 > 192.168.56.1.5001: UDP, length 1470
14:09:17.248831 IP 10.0.2.15.53640 > 192.168.56.1.5001: UDP, length 1470
14:09:17.369771 IP 10.0.2.15.53640 > 192.168.56.1.5001: UDP, length 1470
14:09:17.491130 IP 10.0.2.15.53640 > 192.168.56.1.5001: UDP, length 1470
14:09:17.611727 IP 10.0.2.15.53640 > 192.168.56.1.5001: UDP, length 1470
14:09:17.732878 IP 10.0.2.15.53640 > 192.168.56.1.5001: UDP, length 1470
14:09:17.853476 IP 10.0.2.15.53640 > 192.168.56.1.5001: UDP, length 1470
14:09:17.974420 IP 10.0.2.15.53640 > 192.168.56.1.5001: UDP, length 1470
14:09:18.095913 IP 10.0.2.15.53640 > 192.168.56.1.5001: UDP, length 1470
14:09:18.216912 IP 10.0.2.15.53640 > 192.168.56.1.5001: UDP, length 1470
14:09:18.338293 IP 10.0.2.15.53640 > 192.168.56.1.5001: UDP, length 1470
14:09:18.459093 IP 10.0.2.15.53640 > 192.168.56.1.5001: UDP, length 1470
14:09:18.580319 IP 10.0.2.15.53640 > 192.168.56.1.5001: UDP, length 1470
14:09:18.701382 IP 10.0.2.15.53640 > 192.168.56.1.5001: UDP, length 1470
14:09:18.821511 IP 10.0.2.15.53640 > 192.168.56.1.5001: UDP, length 1470
14:09:18.942978 IP 10.0.2.15.53640 > 192.168.56.1.5001: UDP, length 1470
14:09:19.064340 IP 10.0.2.15.53640 > 192.168.56.1.5001: UDP, length 1470
14:09:19.184341 IP 10.0.2.15.53640 > 192.168.56.1.5001: UDP, length 1470
14:09:19.305273 IP 10.0.2.15.53640 > 192.168.56.1.5001: UDP, length 1470
14:09:19.426182 IP 10.0.2.15.53640 > 192.168.56.1.5001: UDP, length 1470
14:09:19.547103 IP 10.0.2.15.53640 > 192.168.56.1.5001: UDP, length 1470
14:09:19.668878 IP 10.0.2.15.53640 > 192.168.56.1.5001: UDP, length 1470
14:09:19.789076 IP 10.0.2.15.53640 > 192.168.56.1.5001: UDP, length 1470
14:09:19.910123 IP 10.0.2.15.53640 > 192.168.56.1.5001: UDP, length 1470
14:09:20.031038 IP 10.0.2.15.53640 > 192.168.56.1.5001: UDP, length 1470
14:09:20.151993 IP 10.0.2.15.53640 > 192.168.56.1.5001: UDP, length 1470
14:09:20.273017 IP 10.0.2.15.53640 > 192.168.56.1.5001: UDP, length 1470
14:09:20.395410 IP 10.0.2.15.53640 > 192.168.56.1.5001: UDP, length 1470
14:09:20.515011 IP 10.0.2.15.53640 > 192.168.56.1.5001: UDP, length 1470
14:09:20.636949 IP 10.0.2.15.53640 > 192.168.56.1.5001: UDP, length 1470
14:09:20.756690 IP 10.0.2.15.53640 > 192.168.56.1.5001: UDP, length 1470
14:09:20.878902 IP 10.0.2.15.53640 > 192.168.56.1.5001: UDP, length 1470
14:09:20.999123 IP 10.0.2.15.53640 > 192.168.56.1.5001: UDP, length 1470
14:09:21.119445 IP 10.0.2.15.53640 > 192.168.56.1.5001: UDP, length 1470
14:09:21.241219 IP 10.0.2.15.53640 > 192.168.56.1.5001: UDP, length 1470
14:09:21.361406 IP 10.0.2.15.53640 > 192.168.56.1.5001: UDP, length 1470
14:09:21.482479 IP 10.0.2.15.53640 > 192.168.56.1.5001: UDP, length 1470
14:09:21.603533 IP 10.0.2.15.53640 > 192.168.56.1.5001: UDP, length 1470
14:09:21.725459 IP 10.0.2.15.53640 > 192.168.56.1.5001: UDP, length 1470
14:09:21.845414 IP 10.0.2.15.53640 > 192.168.56.1.5001: UDP, length 1470
14:09:21.967010 IP 10.0.2.15.53640 > 192.168.56.1.5001: UDP, length 1470
14:09:22.087393 IP 10.0.2.15.53640 > 192.168.56.1.5001: UDP, length 1470
14:09:22.208227 IP 10.0.2.15.53640 > 192.168.56.1.5001: UDP, length 1470
14:09:22.329853 IP 10.0.2.15.53640 > 192.168.56.1.5001: UDP, length 1470
14:09:22.450236 IP 10.0.2.15.53640 > 192.168.56.1.5001: UDP, length 1470
14:09:22.571160 IP 10.0.2.15.53640 > 192.168.56.1.5001: UDP, length 1470
14:09:22.693323 IP 10.0.2.15.53640 > 192.168.56.1.5001: UDP, length 1470
14:09:22.814001 IP 10.0.2.15.53640 > 192.168.56.1.5001: UDP, length 1470
14:09:22.934678 IP 10.0.2.15.53640 > 192.168.56.1.5001: UDP, length 1470
14:09:23.055812 IP 10.0.2.15.53640 > 192.168.56.1.5001: UDP, length 1470
14:09:23.175640 IP 10.0.2.15.53640 > 192.168.56.1.5001: UDP, length 1470

