00:47:26.173581 IP 192.168.56.101.56966 > 192.168.56.1.5002: UDP, length 1470
00:47:26.657068 IP 192.168.56.101.56966 > 192.168.56.1.5002: UDP, length 1470
00:47:27.262547 IP 192.168.56.101.56966 > 192.168.56.1.5002: UDP, length 1470
00:47:27.866903 IP 192.168.56.101.56966 > 192.168.56.1.5002: UDP, length 1470
00:47:28.471647 IP 192.168.56.101.56966 > 192.168.56.1.5002: UDP, length 1470
00:47:29.076351 IP 192.168.56.101.56966 > 192.168.56.1.5002: UDP, length 1470
00:47:29.681479 IP 192.168.56.101.56966 > 192.168.56.1.5002: UDP, length 1470
00:47:30.287332 IP 192.168.56.101.56966 > 192.168.56.1.5002: UDP, length 1470
00:47:30.891660 IP 192.168.56.101.56966 > 192.168.56.1.5002: UDP, length 1470
00:47:31.495674 IP 192.168.56.101.56966 > 192.168.56.1.5002: UDP, length 1470
00:47:32.100249 IP 192.168.56.101.56966 > 192.168.56.1.5002: UDP, length 1470
00:47:32.705011 IP 192.168.56.101.56966 > 192.168.56.1.5002: UDP, length 1470
00:47:33.310442 IP 192.168.56.101.56966 > 192.168.56.1.5002: UDP, length 1470
00:47:33.914944 IP 192.168.56.101.56966 > 192.168.56.1.5002: UDP, length 1470
00:47:34.519740 IP 192.168.56.101.56966 > 192.168.56.1.5002: UDP, length 1470
00:47:35.124596 IP 192.168.56.101.56966 > 192.168.56.1.5002: UDP, length 1470
00:47:35.729172 IP 192.168.56.101.56966 > 192.168.56.1.5002: UDP, length 1470
00:47:36.334053 IP 192.168.56.101.56966 > 192.168.56.1.5002: UDP, length 1470
00:47:36.938701 IP 192.168.56.101.56966 > 192.168.56.1.5002: UDP, length 1470
00:47:37.543558 IP 192.168.56.101.56966 > 192.168.56.1.5002: UDP, length 1470
00:47:38.149667 IP 192.168.56.101.56966 > 192.168.56.1.5002: UDP, length 1470
00:47:38.755144 IP 192.168.56.101.56966 > 192.168.56.1.5002: UDP, length 1470
00:47:39.358069 IP 192.168.56.101.56966 > 192.168.56.1.5002: UDP, length 1470
00:47:39.964276 IP 192.168.56.101.56966 > 192.168.56.1.5002: UDP, length 1470
00:47:40.568329 IP 192.168.56.101.56966 > 192.168.56.1.5002: UDP, length 1470
00:47:41.172417 IP 192.168.56.101.56966 > 192.168.56.1.5002: UDP, length 1470
00:47:41.777192 IP 192.168.56.101.56966 > 192.168.56.1.5002: UDP, length 1470
00:47:42.383301 IP 192.168.56.101.56966 > 192.168.56.1.5002: UDP, length 1470
00:47:42.988106 IP 192.168.56.101.56966 > 192.168.56.1.5002: UDP, length 1470
00:47:43.591502 IP 192.168.56.101.56966 > 192.168.56.1.5002: UDP, length 1470
00:47:44.196753 IP 192.168.56.101.56966 > 192.168.56.1.5002: UDP, length 1470
00:47:44.801036 IP 192.168.56.101.56966 > 192.168.56.1.5002: UDP, length 1470
00:47:45.405989 IP 192.168.56.101.56966 > 192.168.56.1.5002: UDP, length 1470
00:47:46.011012 IP 192.168.56.101.56966 > 192.168.56.1.5002: UDP, length 1470
00:47:46.615493 IP 192.168.56.101.56966 > 192.168.56.1.5002: UDP, length 1470
00:47:47.220759 IP 192.168.56.101.56966 > 192.168.56.1.5002: UDP, length 1470
00:47:47.825724 IP 192.168.56.101.56966 > 192.168.56.1.5002: UDP, length 1470
00:47:48.429726 IP 192.168.56.101.56966 > 192.168.56.1.5002: UDP, length 1470
00:47:49.034664 IP 192.168.56.101.56966 > 192.168.56.1.5002: UDP, length 1470
00:47:49.640373 IP 192.168.56.101.56966 > 192.168.56.1.5002: UDP, length 1470
00:47:50.244201 IP 192.168.56.101.56966 > 192.168.56.1.5002: UDP, length 1470
00:47:50.850809 IP 192.168.56.101.56966 > 192.168.56.1.5002: UDP, length 1470
00:47:51.454282 IP 192.168.56.101.56966 > 192.168.56.1.5002: UDP, length 1470
00:47:52.059529 IP 192.168.56.101.56966 > 192.168.56.1.5002: UDP, length 1470
00:47:52.663338 IP 192.168.56.101.56966 > 192.168.56.1.5002: UDP, length 1470
00:47:53.268377 IP 192.168.56.101.56966 > 192.168.56.1.5002: UDP, length 1470
00:47:53.873033 IP 192.168.56.101.56966 > 192.168.56.1.5002: UDP, length 1470
00:47:54.479075 IP 192.168.56.101.56966 > 192.168.56.1.5002: UDP, length 1470
00:47:55.083935 IP 192.168.56.101.56966 > 192.168.56.1.5002: UDP, length 1470
00:47:55.688192 IP 192.168.56.101.56966 > 192.168.56.1.5002: UDP, length 1470
00:47:56.292310 IP 192.168.56.101.56966 > 192.168.56.1.5002: UDP, length 1470
00:47:56.898239 IP 192.168.56.101.56966 > 192.168.56.1.5002: UDP, length 1470
00:47:57.501898 IP 192.168.56.101.56966 > 192.168.56.1.5002: UDP, length 1470
00:47:58.107502 IP 192.168.56.101.56966 > 192.168.56.1.5002: UDP, length 1470
00:47:58.712450 IP 192.168.56.101.56966 > 192.168.56.1.5002: UDP, length 1470
00:47:59.316383 IP 192.168.56.101.56966 > 192.168.56.1.5002: UDP, length 1470
00:47:59.921047 IP 192.168.56.101.56966 > 192.168.56.1.5002: UDP, length 1470
00:48:00.525807 IP 192.168.56.101.56966 > 192.168.56.1.5002: UDP, length 1470
00:48:01.131673 IP 192.168.56.101.56966 > 192.168.56.1.5002: UDP, length 1470
00:48:01.736365 IP 192.168.56.101.56966 > 192.168.56.1.5002: UDP, length 1470
00:48:02.340375 IP 192.168.56.101.56966 > 192.168.56.1.5002: UDP, length 1470
00:48:02.945267 IP 192.168.56.101.56966 > 192.168.56.1.5002: UDP, length 1470
00:48:03.549869 IP 192.168.56.101.56966 > 192.168.56.1.5002: UDP, length 1470
00:48:04.155729 IP 192.168.56.101.56966 > 192.168.56.1.5002: UDP, length 1470
00:48:04.760008 IP 192.168.56.101.56966 > 192.168.56.1.5002: UDP, length 1470
00:48:05.365173 IP 192.168.56.101.56966 > 192.168.56.1.5002: UDP, length 1470
00:48:05.969573 IP 192.168.56.101.56966 > 192.168.56.1.5002: UDP, length 1470
00:48:06.574208 IP 192.168.56.101.56966 > 192.168.56.1.5002: UDP, length 1470
00:48:07.178776 IP 192.168.56.101.56966 > 192.168.56.1.5002: UDP, length 1470
00:48:07.783534 IP 192.168.56.101.56966 > 192.168.56.1.5002: UDP, length 1470
00:48:08.389815 IP 192.168.56.101.56966 > 192.168.56.1.5002: UDP, length 1470
00:48:08.993411 IP 192.168.56.101.56966 > 192.168.56.1.5002: UDP, length 1470
00:48:09.598024 IP 192.168.56.101.56966 > 192.168.56.1.5002: UDP, length 1470
00:48:10.203304 IP 192.168.56.101.56966 > 192.168.56.1.5002: UDP, length 1470
00:48:10.807656 IP 192.168.56.101.56966 > 192.168.56.1.5002: UDP, length 1470
00:48:11.412305 IP 192.168.56.101.56966 > 192.168.56.1.5002: UDP, length 1470
00:48:12.017068 IP 192.168.56.101.56966 > 192.168.56.1.5002: UDP, length 1470
00:48:12.621800 IP 192.168.56.101.56966 > 192.168.56.1.5002: UDP, length 1470
00:48:13.227169 IP 192.168.56.101.56966 > 192.168.56.1.5002: UDP, length 1470
00:48:13.832635 IP 192.168.56.101.56966 > 192.168.56.1.5002: UDP, length 1470
00:48:14.436093 IP 192.168.56.101.56966 > 192.168.56.1.5002: UDP, length 1470
00:48:15.041675 IP 192.168.56.101.56966 > 192.168.56.1.5002: UDP, length 1470
00:48:15.645813 IP 192.168.56.101.56966 > 192.168.56.1.5002: UDP, length 1470
00:48:16.251322 IP 192.168.56.101.56966 > 192.168.56.1.5002: UDP, length 1470
00:48:16.855504 IP 192.168.56.101.56966 > 192.168.56.1.5002: UDP, length 1470
00:48:17.460223 IP 192.168.56.101.56966 > 192.168.56.1.5002: UDP, length 1470

