00:03:03.760128 IP 192.168.56.101.38658 > 192.168.56.1.5002: UDP, length 1470
00:03:03.820648 IP 192.168.56.101.38658 > 192.168.56.1.5002: UDP, length 1470
00:03:03.881153 IP 192.168.56.101.38658 > 192.168.56.1.5002: UDP, length 1470
00:03:03.942342 IP 192.168.56.101.38658 > 192.168.56.1.5002: UDP, length 1470
00:03:04.002126 IP 192.168.56.101.38658 > 192.168.56.1.5002: UDP, length 1470
00:03:04.063912 IP 192.168.56.101.38658 > 192.168.56.1.5002: UDP, length 1470
00:03:04.123065 IP 192.168.56.101.38658 > 192.168.56.1.5002: UDP, length 1470
00:03:04.183875 IP 192.168.56.101.38658 > 192.168.56.1.5002: UDP, length 1470
00:03:04.244414 IP 192.168.56.101.38658 > 192.168.56.1.5002: UDP, length 1470
00:03:04.306248 IP 192.168.56.101.38658 > 192.168.56.1.5002: UDP, length 1470
00:03:04.365062 IP 192.168.56.101.38658 > 192.168.56.1.5002: UDP, length 1470
00:03:04.426692 IP 192.168.56.101.38658 > 192.168.56.1.5002: UDP, length 1470
00:03:04.486162 IP 192.168.56.101.38658 > 192.168.56.1.5002: UDP, length 1470
00:03:04.547073 IP 192.168.56.101.38658 > 192.168.56.1.5002: UDP, length 1470
00:03:04.607352 IP 192.168.56.101.38658 > 192.168.56.1.5002: UDP, length 1470
00:03:04.667835 IP 192.168.56.101.38658 > 192.168.56.1.5002: UDP, length 1470
00:03:04.728398 IP 192.168.56.101.38658 > 192.168.56.1.5002: UDP, length 1470
00:03:04.788508 IP 192.168.56.101.38658 > 192.168.56.1.5002: UDP, length 1470
00:03:04.851129 IP 192.168.56.101.38658 > 192.168.56.1.5002: UDP, length 1470
00:03:04.909343 IP 192.168.56.101.38658 > 192.168.56.1.5002: UDP, length 1470
00:03:04.970301 IP 192.168.56.101.38658 > 192.168.56.1.5002: UDP, length 1470
00:03:05.030470 IP 192.168.56.101.38658 > 192.168.56.1.5002: UDP, length 1470
00:03:05.090829 IP 192.168.56.101.38658 > 192.168.56.1.5002: UDP, length 1470
00:03:05.151231 IP 192.168.56.101.38658 > 192.168.56.1.5002: UDP, length 1470
00:03:05.211987 IP 192.168.56.101.38658 > 192.168.56.1.5002: UDP, length 1470
00:03:05.272234 IP 192.168.56.101.38658 > 192.168.56.1.5002: UDP, length 1470
00:03:05.333740 IP 192.168.56.101.38658 > 192.168.56.1.5002: UDP, length 1470
00:03:05.394245 IP 192.168.56.101.38658 > 192.168.56.1.5002: UDP, length 1470
00:03:05.454085 IP 192.168.56.101.38658 > 192.168.56.1.5002: UDP, length 1470
00:03:05.515219 IP 192.168.56.101.38658 > 192.168.56.1.5002: UDP, length 1470
00:03:05.574993 IP 192.168.56.101.38658 > 192.168.56.1.5002: UDP, length 1470
00:03:05.635421 IP 192.168.56.101.38658 > 192.168.56.1.5002: UDP, length 1470
00:03:05.695992 IP 192.168.56.101.38658 > 192.168.56.1.5002: UDP, length 1470
00:03:05.757178 IP 192.168.56.101.38658 > 192.168.56.1.5002: UDP, length 1470
00:03:05.816921 IP 192.168.56.101.38658 > 192.168.56.1.5002: UDP, length 1470
00:03:05.877090 IP 192.168.56.101.38658 > 192.168.56.1.5002: UDP, length 1470
00:03:05.937804 IP 192.168.56.101.38658 > 192.168.56.1.5002: UDP, length 1470
00:03:06.000086 IP 192.168.56.101.38658 > 192.168.56.1.5002: UDP, length 1470
00:03:06.058881 IP 192.168.56.101.38658 > 192.168.56.1.5002: UDP, length 1470
00:03:06.119835 IP 192.168.56.101.38658 > 192.168.56.1.5002: UDP, length 1470
00:03:06.179525 IP 192.168.56.101.38658 > 192.168.56.1.5002: UDP, length 1470
00:03:06.240008 IP 192.168.56.101.38658 > 192.168.56.1.5002: UDP, length 1470
00:03:06.300438 IP 192.168.56.101.38658 > 192.168.56.1.5002: UDP, length 1470
00:03:06.361378 IP 192.168.56.101.38658 > 192.168.56.1.5002: UDP, length 1470
00:03:06.421945 IP 192.168.56.101.38658 > 192.168.56.1.5002: UDP, length 1470
00:03:06.482144 IP 192.168.56.101.38658 > 192.168.56.1.5002: UDP, length 1470
00:03:06.542384 IP 192.168.56.101.38658 > 192.168.56.1.5002: UDP, length 1470
00:03:06.604590 IP 192.168.56.101.38658 > 192.168.56.1.5002: UDP, length 1470
00:03:06.664532 IP 192.168.56.101.38658 > 192.168.56.1.5002: UDP, length 1470
00:03:06.724866 IP 192.168.56.101.38658 > 192.168.56.1.5002: UDP, length 1470
00:03:06.784474 IP 192.168.56.101.38658 > 192.168.56.1.5002: UDP, length 1470
00:03:06.846213 IP 192.168.56.101.38658 > 192.168.56.1.5002: UDP, length 1470
00:03:06.905359 IP 192.168.56.101.38658 > 192.168.56.1.5002: UDP, length 1470
00:03:06.965690 IP 192.168.56.101.38658 > 192.168.56.1.5002: UDP, length 1470
00:03:07.026671 IP 192.168.56.101.38658 > 192.168.56.1.5002: UDP, length 1470
00:03:07.087590 IP 192.168.56.101.38658 > 192.168.56.1.5002: UDP, length 1470
00:03:07.147059 IP 192.168.56.101.38658 > 192.168.56.1.5002: UDP, length 1470
00:03:07.207642 IP 192.168.56.101.38658 > 192.168.56.1.5002: UDP, length 1470
00:03:07.268761 IP 192.168.56.101.38658 > 192.168.56.1.5002: UDP, length 1470
00:03:07.329598 IP 192.168.56.101.38658 > 192.168.56.1.5002: UDP, length 1470
00:03:07.389441 IP 192.168.56.101.38658 > 192.168.56.1.5002: UDP, length 1470
00:03:07.449711 IP 192.168.56.101.38658 > 192.168.56.1.5002: UDP, length 1470
00:03:07.511284 IP 192.168.56.101.38658 > 192.168.56.1.5002: UDP, length 1470
00:03:07.571518 IP 192.168.56.101.38658 > 192.168.56.1.5002: UDP, length 1470
00:03:07.631083 IP 192.168.56.101.38658 > 192.168.56.1.5002: UDP, length 1470
00:03:07.692638 IP 192.168.56.101.38658 > 192.168.56.1.5002: UDP, length 1470
00:03:07.752625 IP 192.168.56.101.38658 > 192.168.56.1.5002: UDP, length 1470
00:03:07.812394 IP 192.168.56.101.38658 > 192.168.56.1.5002: UDP, length 1470
00:03:07.873783 IP 192.168.56.101.38658 > 192.168.56.1.5002: UDP, length 1470
00:03:07.934158 IP 192.168.56.101.38658 > 192.168.56.1.5002: UDP, length 1470
00:03:07.994217 IP 192.168.56.101.38658 > 192.168.56.1.5002: UDP, length 1470
00:03:08.054532 IP 192.168.56.101.38658 > 192.168.56.1.5002: UDP, length 1470
00:03:08.115330 IP 192.168.56.101.38658 > 192.168.56.1.5002: UDP, length 1470
00:03:08.175402 IP 192.168.56.101.38658 > 192.168.56.1.5002: UDP, length 1470
00:03:08.235756 IP 192.168.56.101.38658 > 192.168.56.1.5002: UDP, length 1470
00:03:08.296323 IP 192.168.56.101.38658 > 192.168.56.1.5002: UDP, length 1470
00:03:08.357146 IP 192.168.56.101.38658 > 192.168.56.1.5002: UDP, length 1470
00:03:08.417527 IP 192.168.56.101.38658 > 192.168.56.1.5002: UDP, length 1470
00:03:08.478261 IP 192.168.56.101.38658 > 192.168.56.1.5002: UDP, length 1470
00:03:08.539014 IP 192.168.56.101.38658 > 192.168.56.1.5002: UDP, length 1470
00:03:08.598716 IP 192.168.56.101.38658 > 192.168.56.1.5002: UDP, length 1470
00:03:08.659666 IP 192.168.56.101.38658 > 192.168.56.1.5002: UDP, length 1470
00:03:08.720765 IP 192.168.56.101.38658 > 192.168.56.1.5002: UDP, length 1470
00:03:08.780112 IP 192.168.56.101.38658 > 192.168.56.1.5002: UDP, length 1470
00:03:08.840589 IP 192.168.56.101.38658 > 192.168.56.1.5002: UDP, length 1470
00:03:08.901096 IP 192.168.56.101.38658 > 192.168.56.1.5002: UDP, length 1470
00:03:08.962367 IP 192.168.56.101.38658 > 192.168.56.1.5002: UDP, length 1470
00:03:09.022166 IP 192.168.56.101.38658 > 192.168.56.1.5002: UDP, length 1470
00:03:09.084967 IP 192.168.56.101.38658 > 192.168.56.1.5002: UDP, length 1470
00:03:09.142942 IP 192.168.56.101.38658 > 192.168.56.1.5002: UDP, length 1470
00:03:09.203511 IP 192.168.56.101.38658 > 192.168.56.1.5002: UDP, length 1470
00:03:09.264101 IP 192.168.56.101.38658 > 192.168.56.1.5002: UDP, length 1470
00:03:09.324416 IP 192.168.56.101.38658 > 192.168.56.1.5002: UDP, length 1470
00:03:09.384813 IP 192.168.56.101.38658 > 192.168.56.1.5002: UDP, length 1470
00:03:09.445501 IP 192.168.56.101.38658 > 192.168.56.1.5002: UDP, length 1470
00:03:09.505784 IP 192.168.56.101.38658 > 192.168.56.1.5002: UDP, length 1470
00:03:09.567145 IP 192.168.56.101.38658 > 192.168.56.1.5002: UDP, length 1470
00:03:09.628264 IP 192.168.56.101.38658 > 192.168.56.1.5002: UDP, length 1470
00:03:09.687366 IP 192.168.56.101.38658 > 192.168.56.1.5002: UDP, length 1470
00:03:09.748054 IP 192.168.56.101.38658 > 192.168.56.1.5002: UDP, length 1470
00:03:09.808777 IP 192.168.56.101.38658 > 192.168.56.1.5002: UDP, length 1470
00:03:09.868900 IP 192.168.56.101.38658 > 192.168.56.1.5002: UDP, length 1470
00:03:09.929667 IP 192.168.56.101.38658 > 192.168.56.1.5002: UDP, length 1470
00:03:09.989899 IP 192.168.56.101.38658 > 192.168.56.1.5002: UDP, length 1470
00:03:10.050341 IP 192.168.56.101.38658 > 192.168.56.1.5002: UDP, length 1470
00:03:10.110940 IP 192.168.56.101.38658 > 192.168.56.1.5002: UDP, length 1470
00:03:10.172341 IP 192.168.56.101.38658 > 192.168.56.1.5002: UDP, length 1470
00:03:10.231884 IP 192.168.56.101.38658 > 192.168.56.1.5002: UDP, length 1470
00:03:10.293507 IP 192.168.56.101.38658 > 192.168.56.1.5002: UDP, length 1470
00:03:10.352592 IP 192.168.56.101.38658 > 192.168.56.1.5002: UDP, length 1470
00:03:10.414229 IP 192.168.56.101.38658 > 192.168.56.1.5002: UDP, length 1470
00:03:10.473496 IP 192.168.56.101.38658 > 192.168.56.1.5002: UDP, length 1470
00:03:10.535292 IP 192.168.56.101.38658 > 192.168.56.1.5002: UDP, length 1470
00:03:10.595347 IP 192.168.56.101.38658 > 192.168.56.1.5002: UDP, length 1470
00:03:10.656199 IP 192.168.56.101.38658 > 192.168.56.1.5002: UDP, length 1470
00:03:10.716200 IP 192.168.56.101.38658 > 192.168.56.1.5002: UDP, length 1470
00:03:10.775903 IP 192.168.56.101.38658 > 192.168.56.1.5002: UDP, length 1470
00:03:10.836732 IP 192.168.56.101.38658 > 192.168.56.1.5002: UDP, length 1470
00:03:10.896974 IP 192.168.56.101.38658 > 192.168.56.1.5002: UDP, length 1470
00:03:10.957426 IP 192.168.56.101.38658 > 192.168.56.1.5002: UDP, length 1470
00:03:11.017818 IP 192.168.56.101.38658 > 192.168.56.1.5002: UDP, length 1470
00:03:11.078379 IP 192.168.56.101.38658 > 192.168.56.1.5002: UDP, length 1470
00:03:11.139999 IP 192.168.56.101.38658 > 192.168.56.1.5002: UDP, length 1470
00:03:11.199224 IP 192.168.56.101.38658 > 192.168.56.1.5002: UDP, length 1470
00:03:11.259709 IP 192.168.56.101.38658 > 192.168.56.1.5002: UDP, length 1470
00:03:11.320699 IP 192.168.56.101.38658 > 192.168.56.1.5002: UDP, length 1470
00:03:11.380832 IP 192.168.56.101.38658 > 192.168.56.1.5002: UDP, length 1470
00:03:11.441448 IP 192.168.56.101.38658 > 192.168.56.1.5002: UDP, length 1470
00:03:11.502287 IP 192.168.56.101.38658 > 192.168.56.1.5002: UDP, length 1470
00:03:11.562153 IP 192.168.56.101.38658 > 192.168.56.1.5002: UDP, length 1470
00:03:11.622642 IP 192.168.56.101.38658 > 192.168.56.1.5002: UDP, length 1470
00:03:11.684070 IP 192.168.56.101.38658 > 192.168.56.1.5002: UDP, length 1470
00:03:11.743558 IP 192.168.56.101.38658 > 192.168.56.1.5002: UDP, length 1470
00:03:11.804709 IP 192.168.56.101.38658 > 192.168.56.1.5002: UDP, length 1470
00:03:11.864509 IP 192.168.56.101.38658 > 192.168.56.1.5002: UDP, length 1470
00:03:11.925347 IP 192.168.56.101.38658 > 192.168.56.1.5002: UDP, length 1470
00:03:11.987084 IP 192.168.56.101.38658 > 192.168.56.1.5002: UDP, length 1470
00:03:12.045928 IP 192.168.56.101.38658 > 192.168.56.1.5002: UDP, length 1470
00:03:12.106774 IP 192.168.56.101.38658 > 192.168.56.1.5002: UDP, length 1470
00:03:12.167316 IP 192.168.56.101.38658 > 192.168.56.1.5002: UDP, length 1470
00:03:12.227818 IP 192.168.56.101.38658 > 192.168.56.1.5002: UDP, length 1470
00:03:12.289907 IP 192.168.56.101.38658 > 192.168.56.1.5002: UDP, length 1470
00:03:12.348670 IP 192.168.56.101.38658 > 192.168.56.1.5002: UDP, length 1470
00:03:12.409185 IP 192.168.56.101.38658 > 192.168.56.1.5002: UDP, length 1470
00:03:12.471321 IP 192.168.56.101.38658 > 192.168.56.1.5002: UDP, length 1470
00:03:12.529873 IP 192.168.56.101.38658 > 192.168.56.1.5002: UDP, length 1470
00:03:12.591700 IP 192.168.56.101.38658 > 192.168.56.1.5002: UDP, length 1470
00:03:12.650829 IP 192.168.56.101.38658 > 192.168.56.1.5002: UDP, length 1470
00:03:12.711361 IP 192.168.56.101.38658 > 192.168.56.1.5002: UDP, length 1470
00:03:12.772741 IP 192.168.56.101.38658 > 192.168.56.1.5002: UDP, length 1470
00:03:12.832797 IP 192.168.56.101.38658 > 192.168.56.1.5002: UDP, length 1470
00:03:12.892740 IP 192.168.56.101.38658 > 192.168.56.1.5002: UDP, length 1470
00:03:12.953529 IP 192.168.56.101.38658 > 192.168.56.1.5002: UDP, length 1470
00:03:13.013930 IP 192.168.56.101.38658 > 192.168.56.1.5002: UDP, length 1470
00:03:13.074385 IP 192.168.56.101.38658 > 192.168.56.1.5002: UDP, length 1470
00:03:13.135032 IP 192.168.56.101.38658 > 192.168.56.1.5002: UDP, length 1470
00:03:13.195593 IP 192.168.56.101.38658 > 192.168.56.1.5002: UDP, length 1470
00:03:13.255665 IP 192.168.56.101.38658 > 192.168.56.1.5002: UDP, length 1470
00:03:13.316194 IP 192.168.56.101.38658 > 192.168.56.1.5002: UDP, length 1470
00:03:13.376629 IP 192.168.56.101.38658 > 192.168.56.1.5002: UDP, length 1470
00:03:13.437206 IP 192.168.56.101.38658 > 192.168.56.1.5002: UDP, length 1470
00:03:13.498703 IP 192.168.56.101.38658 > 192.168.56.1.5002: UDP, length 1470
00:03:13.559195 IP 192.168.56.101.38658 > 192.168.56.1.5002: UDP, length 1470
00:03:13.619004 IP 192.168.56.101.38658 > 192.168.56.1.5002: UDP, length 1470
00:03:13.679554 IP 192.168.56.101.38658 > 192.168.56.1.5002: UDP, length 1470
00:03:13.740460 IP 192.168.56.101.38658 > 192.168.56.1.5002: UDP, length 1470
00:03:13.799997 IP 192.168.56.101.38658 > 192.168.56.1.5002: UDP, length 1470
00:03:13.860401 IP 192.168.56.101.38658 > 192.168.56.1.5002: UDP, length 1470
00:03:13.920945 IP 192.168.56.101.38658 > 192.168.56.1.5002: UDP, length 1470
00:03:13.981448 IP 192.168.56.101.38658 > 192.168.56.1.5002: UDP, length 1470
00:03:14.042549 IP 192.168.56.101.38658 > 192.168.56.1.5002: UDP, length 1470
00:03:14.102437 IP 192.168.56.101.38658 > 192.168.56.1.5002: UDP, length 1470
00:03:14.162780 IP 192.168.56.101.38658 > 192.168.56.1.5002: UDP, length 1470
00:03:14.223668 IP 192.168.56.101.38658 > 192.168.56.1.5002: UDP, length 1470
00:03:14.284095 IP 192.168.56.101.38658 > 192.168.56.1.5002: UDP, length 1470
00:03:14.344207 IP 192.168.56.101.38658 > 192.168.56.1.5002: UDP, length 1470
00:03:14.405221 IP 192.168.56.101.38658 > 192.168.56.1.5002: UDP, length 1470
00:03:14.465135 IP 192.168.56.101.38658 > 192.168.56.1.5002: UDP, length 1470
00:03:14.525905 IP 192.168.56.101.38658 > 192.168.56.1.5002: UDP, length 1470
00:03:14.586092 IP 192.168.56.101.38658 > 192.168.56.1.5002: UDP, length 1470
00:03:14.646646 IP 192.168.56.101.38658 > 192.168.56.1.5002: UDP, length 1470
00:03:14.707969 IP 192.168.56.101.38658 > 192.168.56.1.5002: UDP, length 1470
00:03:14.768281 IP 192.168.56.101.38658 > 192.168.56.1.5002: UDP, length 1470
00:03:14.828458 IP 192.168.56.101.38658 > 192.168.56.1.5002: UDP, length 1470
00:03:14.889377 IP 192.168.56.101.38658 > 192.168.56.1.5002: UDP, length 1470
00:03:14.949082 IP 192.168.56.101.38658 > 192.168.56.1.5002: UDP, length 1470
00:03:15.009579 IP 192.168.56.101.38658 > 192.168.56.1.5002: UDP, length 1470
00:03:15.070261 IP 192.168.56.101.38658 > 192.168.56.1.5002: UDP, length 1470
00:03:15.131419 IP 192.168.56.101.38658 > 192.168.56.1.5002: UDP, length 1470
00:03:15.191728 IP 192.168.56.101.38658 > 192.168.56.1.5002: UDP, length 1470
00:03:15.251746 IP 192.168.56.101.38658 > 192.168.56.1.5002: UDP, length 1470
00:03:15.313507 IP 192.168.56.101.38658 > 192.168.56.1.5002: UDP, length 1470
00:03:15.372436 IP 192.168.56.101.38658 > 192.168.56.1.5002: UDP, length 1470
00:03:15.433825 IP 192.168.56.101.38658 > 192.168.56.1.5002: UDP, length 1470
00:03:15.494781 IP 192.168.56.101.38658 > 192.168.56.1.5002: UDP, length 1470
00:03:15.553805 IP 192.168.56.101.38658 > 192.168.56.1.5002: UDP, length 1470
00:03:15.614793 IP 192.168.56.101.38658 > 192.168.56.1.5002: UDP, length 1470
00:03:15.675096 IP 192.168.56.101.38658 > 192.168.56.1.5002: UDP, length 1470
00:03:15.735335 IP 192.168.56.101.38658 > 192.168.56.1.5002: UDP, length 1470
00:03:15.795766 IP 192.168.56.101.38658 > 192.168.56.1.5002: UDP, length 1470
00:03:15.856328 IP 192.168.56.101.38658 > 192.168.56.1.5002: UDP, length 1470
00:03:15.916777 IP 192.168.56.101.38658 > 192.168.56.1.5002: UDP, length 1470
00:03:15.977363 IP 192.168.56.101.38658 > 192.168.56.1.5002: UDP, length 1470
00:03:16.038049 IP 192.168.56.101.38658 > 192.168.56.1.5002: UDP, length 1470
00:03:16.098597 IP 192.168.56.101.38658 > 192.168.56.1.5002: UDP, length 1470
00:03:16.159008 IP 192.168.56.101.38658 > 192.168.56.1.5002: UDP, length 1470
00:03:16.219992 IP 192.168.56.101.38658 > 192.168.56.1.5002: UDP, length 1470
00:03:16.280559 IP 192.168.56.101.38658 > 192.168.56.1.5002: UDP, length 1470
00:03:16.340373 IP 192.168.56.101.38658 > 192.168.56.1.5002: UDP, length 1470
00:03:16.400874 IP 192.168.56.101.38658 > 192.168.56.1.5002: UDP, length 1470
00:03:16.461157 IP 192.168.56.101.38658 > 192.168.56.1.5002: UDP, length 1470
00:03:16.521587 IP 192.168.56.101.38658 > 192.168.56.1.5002: UDP, length 1470
00:03:16.582748 IP 192.168.56.101.38658 > 192.168.56.1.5002: UDP, length 1470
00:03:16.643376 IP 192.168.56.101.38658 > 192.168.56.1.5002: UDP, length 1470
00:03:16.703437 IP 192.168.56.101.38658 > 192.168.56.1.5002: UDP, length 1470
00:03:16.763845 IP 192.168.56.101.38658 > 192.168.56.1.5002: UDP, length 1470
00:03:16.823898 IP 192.168.56.101.38658 > 192.168.56.1.5002: UDP, length 1470
00:03:16.886233 IP 192.168.56.101.38658 > 192.168.56.1.5002: UDP, length 1470
00:03:16.944884 IP 192.168.56.101.38658 > 192.168.56.1.5002: UDP, length 1470
00:03:17.006195 IP 192.168.56.101.38658 > 192.168.56.1.5002: UDP, length 1470
00:03:17.066288 IP 192.168.56.101.38658 > 192.168.56.1.5002: UDP, length 1470
00:03:17.126329 IP 192.168.56.101.38658 > 192.168.56.1.5002: UDP, length 1470
00:03:17.188339 IP 192.168.56.101.38658 > 192.168.56.1.5002: UDP, length 1470
00:03:17.247651 IP 192.168.56.101.38658 > 192.168.56.1.5002: UDP, length 1470
00:03:17.308803 IP 192.168.56.101.38658 > 192.168.56.1.5002: UDP, length 1470
00:03:17.369207 IP 192.168.56.101.38658 > 192.168.56.1.5002: UDP, length 1470
00:03:17.429549 IP 192.168.56.101.38658 > 192.168.56.1.5002: UDP, length 1470
00:03:17.489110 IP 192.168.56.101.38658 > 192.168.56.1.5002: UDP, length 1470
00:03:17.550646 IP 192.168.56.101.38658 > 192.168.56.1.5002: UDP, length 1470
00:03:17.610288 IP 192.168.56.101.38658 > 192.168.56.1.5002: UDP, length 1470
00:03:17.670813 IP 192.168.56.101.38658 > 192.168.56.1.5002: UDP, length 1470
00:03:17.731450 IP 192.168.56.101.38658 > 192.168.56.1.5002: UDP, length 1470
00:03:17.792498 IP 192.168.56.101.38658 > 192.168.56.1.5002: UDP, length 1470
00:03:17.852178 IP 192.168.56.101.38658 > 192.168.56.1.5002: UDP, length 1470
00:03:17.913487 IP 192.168.56.101.38658 > 192.168.56.1.5002: UDP, length 1470
00:03:17.973549 IP 192.168.56.101.38658 > 192.168.56.1.5002: UDP, length 1470
00:03:18.034249 IP 192.168.56.101.38658 > 192.168.56.1.5002: UDP, length 1470
00:03:18.094748 IP 192.168.56.101.38658 > 192.168.56.1.5002: UDP, length 1470
00:03:18.156012 IP 192.168.56.101.38658 > 192.168.56.1.5002: UDP, length 1470
00:03:18.217250 IP 192.168.56.101.38658 > 192.168.56.1.5002: UDP, length 1470
00:03:18.275764 IP 192.168.56.101.38658 > 192.168.56.1.5002: UDP, length 1470
00:03:18.336248 IP 192.168.56.101.38658 > 192.168.56.1.5002: UDP, length 1470
00:03:18.396628 IP 192.168.56.101.38658 > 192.168.56.1.5002: UDP, length 1470
00:03:18.457027 IP 192.168.56.101.38658 > 192.168.56.1.5002: UDP, length 1470
00:03:18.518284 IP 192.168.56.101.38658 > 192.168.56.1.5002: UDP, length 1470
00:03:18.577892 IP 192.168.56.101.38658 > 192.168.56.1.5002: UDP, length 1470
00:03:18.639289 IP 192.168.56.101.38658 > 192.168.56.1.5002: UDP, length 1470
00:03:18.698814 IP 192.168.56.101.38658 > 192.168.56.1.5002: UDP, length 1470
00:03:18.759301 IP 192.168.56.101.38658 > 192.168.56.1.5002: UDP, length 1470
00:03:18.819720 IP 192.168.56.101.38658 > 192.168.56.1.5002: UDP, length 1470
00:03:18.881944 IP 192.168.56.101.38658 > 192.168.56.1.5002: UDP, length 1470
00:03:18.940602 IP 192.168.56.101.38658 > 192.168.56.1.5002: UDP, length 1470
00:03:19.002485 IP 192.168.56.101.38658 > 192.168.56.1.5002: UDP, length 1470
00:03:19.061899 IP 192.168.56.101.38658 > 192.168.56.1.5002: UDP, length 1470
00:03:19.122263 IP 192.168.56.101.38658 > 192.168.56.1.5002: UDP, length 1470
00:03:19.183263 IP 192.168.56.101.38658 > 192.168.56.1.5002: UDP, length 1470
00:03:19.243991 IP 192.168.56.101.38658 > 192.168.56.1.5002: UDP, length 1470
00:03:19.303748 IP 192.168.56.101.38658 > 192.168.56.1.5002: UDP, length 1470
00:03:19.364047 IP 192.168.56.101.38658 > 192.168.56.1.5002: UDP, length 1470
00:03:19.425747 IP 192.168.56.101.38658 > 192.168.56.1.5002: UDP, length 1470
00:03:19.485121 IP 192.168.56.101.38658 > 192.168.56.1.5002: UDP, length 1470
00:03:19.546171 IP 192.168.56.101.38658 > 192.168.56.1.5002: UDP, length 1470
00:03:19.606834 IP 192.168.56.101.38658 > 192.168.56.1.5002: UDP, length 1470
00:03:19.666558 IP 192.168.56.101.38658 > 192.168.56.1.5002: UDP, length 1470
00:03:19.726905 IP 192.168.56.101.38658 > 192.168.56.1.5002: UDP, length 1470
00:03:19.788383 IP 192.168.56.101.38658 > 192.168.56.1.5002: UDP, length 1470
00:03:19.848418 IP 192.168.56.101.38658 > 192.168.56.1.5002: UDP, length 1470
00:03:19.908620 IP 192.168.56.101.38658 > 192.168.56.1.5002: UDP, length 1470
00:03:19.968824 IP 192.168.56.101.38658 > 192.168.56.1.5002: UDP, length 1470
00:03:20.030281 IP 192.168.56.101.38658 > 192.168.56.1.5002: UDP, length 1470
00:03:20.090787 IP 192.168.56.101.38658 > 192.168.56.1.5002: UDP, length 1470
00:03:20.150329 IP 192.168.56.101.38658 > 192.168.56.1.5002: UDP, length 1470
00:03:20.210769 IP 192.168.56.101.38658 > 192.168.56.1.5002: UDP, length 1470
00:03:20.271225 IP 192.168.56.101.38658 > 192.168.56.1.5002: UDP, length 1470
00:03:20.333231 IP 192.168.56.101.38658 > 192.168.56.1.5002: UDP, length 1470
00:03:20.393092 IP 192.168.56.101.38658 > 192.168.56.1.5002: UDP, length 1470
00:03:20.453445 IP 192.168.56.101.38658 > 192.168.56.1.5002: UDP, length 1470
00:03:20.513231 IP 192.168.56.101.38658 > 192.168.56.1.5002: UDP, length 1470
00:03:20.574382 IP 192.168.56.101.38658 > 192.168.56.1.5002: UDP, length 1470
00:03:20.636232 IP 192.168.56.101.38658 > 192.168.56.1.5002: UDP, length 1470
00:03:20.694875 IP 192.168.56.101.38658 > 192.168.56.1.5002: UDP, length 1470
00:03:20.755395 IP 192.168.56.101.38658 > 192.168.56.1.5002: UDP, length 1470
00:03:20.815985 IP 192.168.56.101.38658 > 192.168.56.1.5002: UDP, length 1470
00:03:20.877010 IP 192.168.56.101.38658 > 192.168.56.1.5002: UDP, length 1470
00:03:20.937641 IP 192.168.56.101.38658 > 192.168.56.1.5002: UDP, length 1470
00:03:20.997001 IP 192.168.56.101.38658 > 192.168.56.1.5002: UDP, length 1470
00:03:21.057954 IP 192.168.56.101.38658 > 192.168.56.1.5002: UDP, length 1470
00:03:21.117932 IP 192.168.56.101.38658 > 192.168.56.1.5002: UDP, length 1470
00:03:21.178512 IP 192.168.56.101.38658 > 192.168.56.1.5002: UDP, length 1470
00:03:21.238993 IP 192.168.56.101.38658 > 192.168.56.1.5002: UDP, length 1470
00:03:21.299386 IP 192.168.56.101.38658 > 192.168.56.1.5002: UDP, length 1470
00:03:21.360824 IP 192.168.56.101.38658 > 192.168.56.1.5002: UDP, length 1470
00:03:21.422000 IP 192.168.56.101.38658 > 192.168.56.1.5002: UDP, length 1470
00:03:21.480807 IP 192.168.56.101.38658 > 192.168.56.1.5002: UDP, length 1470
00:03:21.541353 IP 192.168.56.101.38658 > 192.168.56.1.5002: UDP, length 1470
00:03:21.602610 IP 192.168.56.101.38658 > 192.168.56.1.5002: UDP, length 1470
00:03:21.662898 IP 192.168.56.101.38658 > 192.168.56.1.5002: UDP, length 1470
00:03:21.723888 IP 192.168.56.101.38658 > 192.168.56.1.5002: UDP, length 1470
00:03:21.783370 IP 192.168.56.101.38658 > 192.168.56.1.5002: UDP, length 1470
00:03:21.843931 IP 192.168.56.101.38658 > 192.168.56.1.5002: UDP, length 1470
00:03:21.904481 IP 192.168.56.101.38658 > 192.168.56.1.5002: UDP, length 1470
00:03:21.964956 IP 192.168.56.101.38658 > 192.168.56.1.5002: UDP, length 1470
00:03:22.026166 IP 192.168.56.101.38658 > 192.168.56.1.5002: UDP, length 1470
00:03:22.086318 IP 192.168.56.101.38658 > 192.168.56.1.5002: UDP, length 1470
00:03:22.146332 IP 192.168.56.101.38658 > 192.168.56.1.5002: UDP, length 1470
00:03:22.207879 IP 192.168.56.101.38658 > 192.168.56.1.5002: UDP, length 1470
00:03:22.267547 IP 192.168.56.101.38658 > 192.168.56.1.5002: UDP, length 1470
00:03:22.328635 IP 192.168.56.101.38658 > 192.168.56.1.5002: UDP, length 1470
00:03:22.388576 IP 192.168.56.101.38658 > 192.168.56.1.5002: UDP, length 1470
00:03:22.449383 IP 192.168.56.101.38658 > 192.168.56.1.5002: UDP, length 1470
00:03:22.509143 IP 192.168.56.101.38658 > 192.168.56.1.5002: UDP, length 1470
00:03:22.569633 IP 192.168.56.101.38658 > 192.168.56.1.5002: UDP, length 1470
00:03:22.630885 IP 192.168.56.101.38658 > 192.168.56.1.5002: UDP, length 1470
00:03:22.691800 IP 192.168.56.101.38658 > 192.168.56.1.5002: UDP, length 1470
00:03:22.752028 IP 192.168.56.101.38658 > 192.168.56.1.5002: UDP, length 1470
00:03:22.811484 IP 192.168.56.101.38658 > 192.168.56.1.5002: UDP, length 1470
00:03:22.872975 IP 192.168.56.101.38658 > 192.168.56.1.5002: UDP, length 1470
00:03:22.932784 IP 192.168.56.101.38658 > 192.168.56.1.5002: UDP, length 1470
00:03:22.993336 IP 192.168.56.101.38658 > 192.168.56.1.5002: UDP, length 1470
00:03:23.053664 IP 192.168.56.101.38658 > 192.168.56.1.5002: UDP, length 1470
00:03:23.115434 IP 192.168.56.101.38658 > 192.168.56.1.5002: UDP, length 1470
00:03:23.174644 IP 192.168.56.101.38658 > 192.168.56.1.5002: UDP, length 1470
00:03:23.235150 IP 192.168.56.101.38658 > 192.168.56.1.5002: UDP, length 1470
00:03:23.296475 IP 192.168.56.101.38658 > 192.168.56.1.5002: UDP, length 1470
00:03:23.356127 IP 192.168.56.101.38658 > 192.168.56.1.5002: UDP, length 1470
00:03:23.418283 IP 192.168.56.101.38658 > 192.168.56.1.5002: UDP, length 1470
00:03:23.477621 IP 192.168.56.101.38658 > 192.168.56.1.5002: UDP, length 1470
00:03:23.537644 IP 192.168.56.101.38658 > 192.168.56.1.5002: UDP, length 1470
00:03:23.598134 IP 192.168.56.101.38658 > 192.168.56.1.5002: UDP, length 1470
00:03:23.659552 IP 192.168.56.101.38658 > 192.168.56.1.5002: UDP, length 1470
00:03:23.718842 IP 192.168.56.101.38658 > 192.168.56.1.5002: UDP, length 1470
00:03:23.779013 IP 192.168.56.101.38658 > 192.168.56.1.5002: UDP, length 1470
00:03:23.839658 IP 192.168.56.101.38658 > 192.168.56.1.5002: UDP, length 1470
00:03:23.901318 IP 192.168.56.101.38658 > 192.168.56.1.5002: UDP, length 1470
00:03:23.962205 IP 192.168.56.101.38658 > 192.168.56.1.5002: UDP, length 1470
00:03:24.021095 IP 192.168.56.101.38658 > 192.168.56.1.5002: UDP, length 1470
00:03:24.081745 IP 192.168.56.101.38658 > 192.168.56.1.5002: UDP, length 1470
00:03:24.142082 IP 192.168.56.101.38658 > 192.168.56.1.5002: UDP, length 1470
00:03:24.203580 IP 192.168.56.101.38658 > 192.168.56.1.5002: UDP, length 1470
00:03:24.264101 IP 192.168.56.101.38658 > 192.168.56.1.5002: UDP, length 1470
00:03:24.323792 IP 192.168.56.101.38658 > 192.168.56.1.5002: UDP, length 1470
00:03:24.384626 IP 192.168.56.101.38658 > 192.168.56.1.5002: UDP, length 1470
00:03:24.445056 IP 192.168.56.101.38658 > 192.168.56.1.5002: UDP, length 1470
00:03:24.506341 IP 192.168.56.101.38658 > 192.168.56.1.5002: UDP, length 1470
00:03:24.565599 IP 192.168.56.101.38658 > 192.168.56.1.5002: UDP, length 1470
00:03:24.627768 IP 192.168.56.101.38658 > 192.168.56.1.5002: UDP, length 1470
00:03:24.686323 IP 192.168.56.101.38658 > 192.168.56.1.5002: UDP, length 1470
00:03:24.747237 IP 192.168.56.101.38658 > 192.168.56.1.5002: UDP, length 1470
00:03:24.807228 IP 192.168.56.101.38658 > 192.168.56.1.5002: UDP, length 1470
00:03:24.868606 IP 192.168.56.101.38658 > 192.168.56.1.5002: UDP, length 1470
00:03:24.928457 IP 192.168.56.101.38658 > 192.168.56.1.5002: UDP, length 1470
00:03:24.990551 IP 192.168.56.101.38658 > 192.168.56.1.5002: UDP, length 1470
00:03:25.050633 IP 192.168.56.101.38658 > 192.168.56.1.5002: UDP, length 1470
00:03:25.110060 IP 192.168.56.101.38658 > 192.168.56.1.5002: UDP, length 1470
00:03:25.171034 IP 192.168.56.101.38658 > 192.168.56.1.5002: UDP, length 1470
00:03:25.230569 IP 192.168.56.101.38658 > 192.168.56.1.5002: UDP, length 1470
00:03:25.292087 IP 192.168.56.101.38658 > 192.168.56.1.5002: UDP, length 1470
00:03:25.351750 IP 192.168.56.101.38658 > 192.168.56.1.5002: UDP, length 1470
00:03:25.412867 IP 192.168.56.101.38658 > 192.168.56.1.5002: UDP, length 1470
00:03:25.473372 IP 192.168.56.101.38658 > 192.168.56.1.5002: UDP, length 1470
00:03:25.533802 IP 192.168.56.101.38658 > 192.168.56.1.5002: UDP, length 1470
00:03:25.593541 IP 192.168.56.101.38658 > 192.168.56.1.5002: UDP, length 1470
00:03:25.653962 IP 192.168.56.101.38658 > 192.168.56.1.5002: UDP, length 1470
00:03:25.714452 IP 192.168.56.101.38658 > 192.168.56.1.5002: UDP, length 1470
00:03:25.776118 IP 192.168.56.101.38658 > 192.168.56.1.5002: UDP, length 1470
00:03:25.835698 IP 192.168.56.101.38658 > 192.168.56.1.5002: UDP, length 1470
00:03:25.896366 IP 192.168.56.101.38658 > 192.168.56.1.5002: UDP, length 1470
00:03:25.956352 IP 192.168.56.101.38658 > 192.168.56.1.5002: UDP, length 1470
00:03:26.016840 IP 192.168.56.101.38658 > 192.168.56.1.5002: UDP, length 1470
00:03:26.077270 IP 192.168.56.101.38658 > 192.168.56.1.5002: UDP, length 1470
00:03:26.137869 IP 192.168.56.101.38658 > 192.168.56.1.5002: UDP, length 1470
00:03:26.198426 IP 192.168.56.101.38658 > 192.168.56.1.5002: UDP, length 1470
00:03:26.258909 IP 192.168.56.101.38658 > 192.168.56.1.5002: UDP, length 1470
00:03:26.320123 IP 192.168.56.101.38658 > 192.168.56.1.5002: UDP, length 1470
00:03:26.379802 IP 192.168.56.101.38658 > 192.168.56.1.5002: UDP, length 1470
00:03:26.440262 IP 192.168.56.101.38658 > 192.168.56.1.5002: UDP, length 1470
00:03:26.500650 IP 192.168.56.101.38658 > 192.168.56.1.5002: UDP, length 1470
00:03:26.562046 IP 192.168.56.101.38658 > 192.168.56.1.5002: UDP, length 1470
00:03:26.621937 IP 192.168.56.101.38658 > 192.168.56.1.5002: UDP, length 1470
00:03:26.682221 IP 192.168.56.101.38658 > 192.168.56.1.5002: UDP, length 1470
00:03:26.743506 IP 192.168.56.101.38658 > 192.168.56.1.5002: UDP, length 1470
00:03:26.803092 IP 192.168.56.101.38658 > 192.168.56.1.5002: UDP, length 1470
00:03:26.864415 IP 192.168.56.101.38658 > 192.168.56.1.5002: UDP, length 1470
00:03:26.924116 IP 192.168.56.101.38658 > 192.168.56.1.5002: UDP, length 1470
00:03:26.984375 IP 192.168.56.101.38658 > 192.168.56.1.5002: UDP, length 1470
00:03:27.045116 IP 192.168.56.101.38658 > 192.168.56.1.5002: UDP, length 1470
00:03:27.105545 IP 192.168.56.101.38658 > 192.168.56.1.5002: UDP, length 1470
00:03:27.166840 IP 192.168.56.101.38658 > 192.168.56.1.5002: UDP, length 1470
00:03:27.226578 IP 192.168.56.101.38658 > 192.168.56.1.5002: UDP, length 1470
00:03:27.287323 IP 192.168.56.101.38658 > 192.168.56.1.5002: UDP, length 1470
00:03:27.347527 IP 192.168.56.101.38658 > 192.168.56.1.5002: UDP, length 1470
00:03:27.407961 IP 192.168.56.101.38658 > 192.168.56.1.5002: UDP, length 1470
00:03:27.468520 IP 192.168.56.101.38658 > 192.168.56.1.5002: UDP, length 1470
00:03:27.529696 IP 192.168.56.101.38658 > 192.168.56.1.5002: UDP, length 1470
00:03:27.589411 IP 192.168.56.101.38658 > 192.168.56.1.5002: UDP, length 1470
00:03:27.652767 IP 192.168.56.101.38658 > 192.168.56.1.5002: UDP, length 1470
00:03:27.712805 IP 192.168.56.101.38658 > 192.168.56.1.5002: UDP, length 1470
00:03:27.771549 IP 192.168.56.101.38658 > 192.168.56.1.5002: UDP, length 1470
00:03:27.831301 IP 192.168.56.101.38658 > 192.168.56.1.5002: UDP, length 1470
00:03:27.891905 IP 192.168.56.101.38658 > 192.168.56.1.5002: UDP, length 1470
00:03:27.953075 IP 192.168.56.101.38658 > 192.168.56.1.5002: UDP, length 1470
00:03:28.012614 IP 192.168.56.101.38658 > 192.168.56.1.5002: UDP, length 1470
00:03:28.073102 IP 192.168.56.101.38658 > 192.168.56.1.5002: UDP, length 1470
00:03:28.133758 IP 192.168.56.101.38658 > 192.168.56.1.5002: UDP, length 1470
00:03:28.194408 IP 192.168.56.101.38658 > 192.168.56.1.5002: UDP, length 1470
00:03:28.255306 IP 192.168.56.101.38658 > 192.168.56.1.5002: UDP, length 1470
00:03:28.315848 IP 192.168.56.101.38658 > 192.168.56.1.5002: UDP, length 1470
00:03:28.375606 IP 192.168.56.101.38658 > 192.168.56.1.5002: UDP, length 1470
00:03:28.437369 IP 192.168.56.101.38658 > 192.168.56.1.5002: UDP, length 1470
00:03:28.497533 IP 192.168.56.101.38658 > 192.168.56.1.5002: UDP, length 1470
00:03:28.556960 IP 192.168.56.101.38658 > 192.168.56.1.5002: UDP, length 1470
00:03:28.617591 IP 192.168.56.101.38658 > 192.168.56.1.5002: UDP, length 1470
00:03:28.678797 IP 192.168.56.101.38658 > 192.168.56.1.5002: UDP, length 1470
00:03:28.738569 IP 192.168.56.101.38658 > 192.168.56.1.5002: UDP, length 1470
00:03:28.799756 IP 192.168.56.101.38658 > 192.168.56.1.5002: UDP, length 1470
00:03:28.859459 IP 192.168.56.101.38658 > 192.168.56.1.5002: UDP, length 1470
00:03:28.920243 IP 192.168.56.101.38658 > 192.168.56.1.5002: UDP, length 1470
00:03:28.980552 IP 192.168.56.101.38658 > 192.168.56.1.5002: UDP, length 1470
00:03:29.041120 IP 192.168.56.101.38658 > 192.168.56.1.5002: UDP, length 1470
00:03:29.102430 IP 192.168.56.101.38658 > 192.168.56.1.5002: UDP, length 1470
00:03:29.162819 IP 192.168.56.101.38658 > 192.168.56.1.5002: UDP, length 1470
00:03:29.222698 IP 192.168.56.101.38658 > 192.168.56.1.5002: UDP, length 1470
00:03:29.284805 IP 192.168.56.101.38658 > 192.168.56.1.5002: UDP, length 1470
00:03:29.344906 IP 192.168.56.101.38658 > 192.168.56.1.5002: UDP, length 1470
00:03:29.404141 IP 192.168.56.101.38658 > 192.168.56.1.5002: UDP, length 1470
00:03:29.466683 IP 192.168.56.101.38658 > 192.168.56.1.5002: UDP, length 1470
00:03:29.525690 IP 192.168.56.101.38658 > 192.168.56.1.5002: UDP, length 1470
00:03:29.585470 IP 192.168.56.101.38658 > 192.168.56.1.5002: UDP, length 1470
00:03:29.647729 IP 192.168.56.101.38658 > 192.168.56.1.5002: UDP, length 1470
00:03:29.706496 IP 192.168.56.101.38658 > 192.168.56.1.5002: UDP, length 1470
00:03:29.766698 IP 192.168.56.101.38658 > 192.168.56.1.5002: UDP, length 1470
00:03:29.827783 IP 192.168.56.101.38658 > 192.168.56.1.5002: UDP, length 1470
00:03:29.888794 IP 192.168.56.101.38658 > 192.168.56.1.5002: UDP, length 1470
00:03:29.948052 IP 192.168.56.101.38658 > 192.168.56.1.5002: UDP, length 1470
00:03:30.008623 IP 192.168.56.101.38658 > 192.168.56.1.5002: UDP, length 1470
00:03:30.069456 IP 192.168.56.101.38658 > 192.168.56.1.5002: UDP, length 1470
00:03:30.129841 IP 192.168.56.101.38658 > 192.168.56.1.5002: UDP, length 1470
00:03:30.190514 IP 192.168.56.101.38658 > 192.168.56.1.5002: UDP, length 1470
00:03:30.252158 IP 192.168.56.101.38658 > 192.168.56.1.5002: UDP, length 1470
00:03:30.312028 IP 192.168.56.101.38658 > 192.168.56.1.5002: UDP, length 1470
00:03:30.371779 IP 192.168.56.101.38658 > 192.168.56.1.5002: UDP, length 1470
00:03:30.433801 IP 192.168.56.101.38658 > 192.168.56.1.5002: UDP, length 1470
00:03:30.493620 IP 192.168.56.101.38658 > 192.168.56.1.5002: UDP, length 1470
00:03:30.553842 IP 192.168.56.101.38658 > 192.168.56.1.5002: UDP, length 1470
00:03:30.613725 IP 192.168.56.101.38658 > 192.168.56.1.5002: UDP, length 1470
00:03:30.674045 IP 192.168.56.101.38658 > 192.168.56.1.5002: UDP, length 1470
00:03:30.734955 IP 192.168.56.101.38658 > 192.168.56.1.5002: UDP, length 1470
00:03:30.795978 IP 192.168.56.101.38658 > 192.168.56.1.5002: UDP, length 1470
00:03:30.857482 IP 192.168.56.101.38658 > 192.168.56.1.5002: UDP, length 1470
00:03:30.916910 IP 192.168.56.101.38658 > 192.168.56.1.5002: UDP, length 1470
00:03:30.976456 IP 192.168.56.101.38658 > 192.168.56.1.5002: UDP, length 1470
00:03:31.038160 IP 192.168.56.101.38658 > 192.168.56.1.5002: UDP, length 1470
00:03:31.097675 IP 192.168.56.101.38658 > 192.168.56.1.5002: UDP, length 1470
00:03:31.157868 IP 192.168.56.101.38658 > 192.168.56.1.5002: UDP, length 1470
00:03:31.218314 IP 192.168.56.101.38658 > 192.168.56.1.5002: UDP, length 1470
00:03:31.280264 IP 192.168.56.101.38658 > 192.168.56.1.5002: UDP, length 1470
00:03:31.341305 IP 192.168.56.101.38658 > 192.168.56.1.5002: UDP, length 1470
00:03:31.400284 IP 192.168.56.101.38658 > 192.168.56.1.5002: UDP, length 1470
00:03:31.460498 IP 192.168.56.101.38658 > 192.168.56.1.5002: UDP, length 1470
00:03:31.520937 IP 192.168.56.101.38658 > 192.168.56.1.5002: UDP, length 1470
00:03:31.582630 IP 192.168.56.101.38658 > 192.168.56.1.5002: UDP, length 1470
00:03:31.641947 IP 192.168.56.101.38658 > 192.168.56.1.5002: UDP, length 1470
00:03:31.702345 IP 192.168.56.101.38658 > 192.168.56.1.5002: UDP, length 1470
00:03:31.762578 IP 192.168.56.101.38658 > 192.168.56.1.5002: UDP, length 1470
00:03:31.822996 IP 192.168.56.101.38658 > 192.168.56.1.5002: UDP, length 1470
00:03:31.883405 IP 192.168.56.101.38658 > 192.168.56.1.5002: UDP, length 1470
00:03:31.944022 IP 192.168.56.101.38658 > 192.168.56.1.5002: UDP, length 1470
00:03:32.004668 IP 192.168.56.101.38658 > 192.168.56.1.5002: UDP, length 1470
00:03:32.064879 IP 192.168.56.101.38658 > 192.168.56.1.5002: UDP, length 1470
00:03:32.126296 IP 192.168.56.101.38658 > 192.168.56.1.5002: UDP, length 1470
00:03:32.185947 IP 192.168.56.101.38658 > 192.168.56.1.5002: UDP, length 1470
00:03:32.247444 IP 192.168.56.101.38658 > 192.168.56.1.5002: UDP, length 1470
00:03:32.306947 IP 192.168.56.101.38658 > 192.168.56.1.5002: UDP, length 1470
00:03:32.368373 IP 192.168.56.101.38658 > 192.168.56.1.5002: UDP, length 1470
00:03:32.427756 IP 192.168.56.101.38658 > 192.168.56.1.5002: UDP, length 1470
00:03:32.489566 IP 192.168.56.101.38658 > 192.168.56.1.5002: UDP, length 1470
00:03:32.549747 IP 192.168.56.101.38658 > 192.168.56.1.5002: UDP, length 1470
00:03:32.609299 IP 192.168.56.101.38658 > 192.168.56.1.5002: UDP, length 1470
00:03:32.670274 IP 192.168.56.101.38658 > 192.168.56.1.5002: UDP, length 1470
00:03:32.730275 IP 192.168.56.101.38658 > 192.168.56.1.5002: UDP, length 1470
00:03:32.791005 IP 192.168.56.101.38658 > 192.168.56.1.5002: UDP, length 1470
00:03:32.851062 IP 192.168.56.101.38658 > 192.168.56.1.5002: UDP, length 1470
00:03:32.911661 IP 192.168.56.101.38658 > 192.168.56.1.5002: UDP, length 1470
00:03:32.972107 IP 192.168.56.101.38658 > 192.168.56.1.5002: UDP, length 1470
00:03:33.032629 IP 192.168.56.101.38658 > 192.168.56.1.5002: UDP, length 1470
00:03:33.092938 IP 192.168.56.101.38658 > 192.168.56.1.5002: UDP, length 1470
00:03:33.154358 IP 192.168.56.101.38658 > 192.168.56.1.5002: UDP, length 1470
00:03:33.214008 IP 192.168.56.101.38658 > 192.168.56.1.5002: UDP, length 1470
00:03:33.274473 IP 192.168.56.101.38658 > 192.168.56.1.5002: UDP, length 1470
00:03:33.334975 IP 192.168.56.101.38658 > 192.168.56.1.5002: UDP, length 1470
00:03:33.395673 IP 192.168.56.101.38658 > 192.168.56.1.5002: UDP, length 1470
00:03:33.456034 IP 192.168.56.101.38658 > 192.168.56.1.5002: UDP, length 1470
00:03:33.517998 IP 192.168.56.101.38658 > 192.168.56.1.5002: UDP, length 1470
00:03:33.577478 IP 192.168.56.101.38658 > 192.168.56.1.5002: UDP, length 1470
00:03:33.638247 IP 192.168.56.101.38658 > 192.168.56.1.5002: UDP, length 1470
00:03:33.697999 IP 192.168.56.101.38658 > 192.168.56.1.5002: UDP, length 1470
00:03:33.759254 IP 192.168.56.101.38658 > 192.168.56.1.5002: UDP, length 1470
00:03:33.818969 IP 192.168.56.101.38658 > 192.168.56.1.5002: UDP, length 1470
00:03:33.880213 IP 192.168.56.101.38658 > 192.168.56.1.5002: UDP, length 1470
00:03:33.939867 IP 192.168.56.101.38658 > 192.168.56.1.5002: UDP, length 1470
00:03:34.000321 IP 192.168.56.101.38658 > 192.168.56.1.5002: UDP, length 1470
00:03:34.060831 IP 192.168.56.101.38658 > 192.168.56.1.5002: UDP, length 1470
00:03:34.122053 IP 192.168.56.101.38658 > 192.168.56.1.5002: UDP, length 1470
00:03:34.181948 IP 192.168.56.101.38658 > 192.168.56.1.5002: UDP, length 1470
00:03:34.242417 IP 192.168.56.101.38658 > 192.168.56.1.5002: UDP, length 1470
00:03:34.303864 IP 192.168.56.101.38658 > 192.168.56.1.5002: UDP, length 1470
00:03:34.363504 IP 192.168.56.101.38658 > 192.168.56.1.5002: UDP, length 1470
00:03:34.423935 IP 192.168.56.101.38658 > 192.168.56.1.5002: UDP, length 1470
00:03:34.484434 IP 192.168.56.101.38658 > 192.168.56.1.5002: UDP, length 1470
00:03:34.545594 IP 192.168.56.101.38658 > 192.168.56.1.5002: UDP, length 1470
00:03:34.605340 IP 192.168.56.101.38658 > 192.168.56.1.5002: UDP, length 1470
00:03:34.665582 IP 192.168.56.101.38658 > 192.168.56.1.5002: UDP, length 1470
